651	1	a	Poitou-Charentes Bulletin de santé du végétal ÉDITION CULTURES L ÉGUMIÈRES Numéro 89 du 22 mai 2013 Prochain numéro le 5 juin En résumé : POIREAU POMME DE TERRE PRIMEUR CAROTTE – CELERI-RAVE MELON MÉTÉOROLOGIE PASSEE : Teigne du poireau : Pas de capture de teigne dans les pièges positionnés dans des pépinières.
498	1	a	Le risque sésamie lié aux larves baladeuses devait être pris en compte à partir de cette semaine dans les secteurs concernés de la Cha- rente et de la Charente-Maritime.
1454	2	a	Mildiou Mildiou Mildiou Mildiou Températures basses : fac- teur limitant du démarrage des contaminations pri- maires.
452	1	a	Deux es pèces sorten t Attention de ne pas confondre les deux espèces de charan çons - Charançon de la tige du chou ( Ceu thorhynchus quadridens) Ins ecte non nuis ible reconna iss ab le es pattes rousses , sa cou leur gris cla ir avec tache b lanche s ur le dos (lors que l ’ins ecte es ec ) sa pe ti te ta i lle (2 .5 à 3mm ).
571	1	a	Page 7 / 13 N° 16 DU 27 MAI 2014 Encadré abeilles pour les grandes cultures oléo- protéagineuses, légumineuse et production de semences (colza, tournesol, féverole, luzerne, en particulier) Les abeilles butinent, protégeons les !
1544	2	a	La Chambre régionale d’agriculture du Centre dégage donc toute responsabilité quant aux décisions prises par les agriculteurs pour la protection de leurs cultures Action pilotée par le Ministère chargé de l'agriculture avec l'appui financier de l'ONEMA, par les crédits issus de la redevance pour pollution diffuses attribués au financement du plan Ecophyto 2018 BS NA - N° 05 du 21/06/2013 Vigne Contexte d’observations D’après le BSV Vigne – région Centre du 18/06/13 Mildiou de la vigne Etat général Les premières taches sont détectées sur vigne non traitée dans le secteur de St Nicolas de Bourgueil (37).
198	0	a	arbre cultivé pour son fruit à coques la noix. La noix est riche en lipides dont on extrait de l'huile alimentaire.
1184	1	a	Tenthrèdes de la rave Tenthrèdes de la rave Tenthrèdes de la rave Tenthrèdes de la rave larve de Tenthrède de la rave : Période de risque Période de risque Période de risque Période de risque De la levée jusqu’au stade 6 feuilles.
1079	1	a	Pucerons 7 parcelles ont fait l’objet d’une observation spécifique de ce ravageur.
1307	1	a	Évaluation du risque : à surveiller • Maladie de la suie et Crottes de mouche Ces deux maladies sont souvent associées et peuvent occasionnellement provoquer des dégâts.
168	0	a	Plante utilisée comme fourrage dans la création de prairies artificelles et temporaires
2416	2	a	Analyse de risque : Les dégâts sont provoqués, d’une part, par les piqûres de prélèvements de sève (flétrissement des jeunes plantes) et d’autre part, par la transmission de virus.
2439	2	a	Globalement cette maladie évolue peu depuis près d’un mois, ce qui peut s’expliquer par une protection sanitaire très serrée vis-à-vis du mildiou.
1678	2	a	Oïdium : sur 12 parcelles observées, 1 seule (dans le Calvados) présente des symptômes sur F3 et F2 (10% de plantes atteintes).
1865	2	a	Les prochaines pluies (orages localisés) devraient générer de nouvelles attaques de bactériose avec encore des risques de contaminations.
639	1	a	Le seuil de nuisibilité est atteint lorsque plusieurs dizaines de pucerons sont comptabilisés et qu’ils sont présents d’une semaine sur l’autre.
1107	1	a	En région Centre le recours à l’irrigation limite fréquemment le développement des chenilles .
2351	2	a	A ce jour, le risque oïdium reste élevé, tout particulier en cette période de forte sensibilité des inflorescences.
159	0	a	Ensemble de plantes cultivées pour leurs tubercules comestibles par l'homme sous forme de légumes.
152	0	a	Plantes potagères cultivées pour leurs bulbes comestibles par l'homme sous forme de légumes.
1978	2	a	La pression mildiou a été différente selon les secteurs, ainsi au cours du mois d’avril et de mai, le risque mildiou est resté faible dans les secteurs de Cestas, de Sore et de Birac-sur-Trec.
904	1	a	 Page – N °  Carpocapse Observations Contrôles des populations Le premier vol est maintenant confirmé, avec de nouvelles prises en Maine-et-Loire, et d’autres signalées en Sarthe.
1158	1	a	 : - Larve de hanneton commun en dernière année de développement Observations : En Corrèze, en 2012, il a été constaté des phénomènes d’affaiblissement de jeunes plantations incriminées aux larves de hannetons.
2455	2	a	Néanmoins les premières gelées enregistrées et celles annoncées les jours à venir devraient permettre de réduire le risque lié à la transmission du virus de jaunisse nanisante de l’orge par les pucerons du feuillage.
132	0	a	arbre tropical et arbre fruitier cultivé pour son fruit la goyave. Il existe plusieurs variétés de goyaves.
504	1	a	La présence de pucerons se maintient sur 4 parcelles avec une présence de 10 pucerons/ plante.
1927	2	a	Les bai es dégradées (perforations de larves de tordeuses, éclatement des baies suite à une attaque d’oïdium ou sous l’effet de la grêle…) sont les voies privilégiées pour l’installation de la pourriture grise.
1207	1	a	TORDEUSES Situation Le réseau de piégeage est en place au vignoble.
1507	2	a	Sur 118 parcelles observées, l’oïdium n’a été décelé que dans 6 situations de Chardonnay à fort historique oïdium (2 en 71, 3 en 21 et 1 en 89).
490	1	a	(tenthrède du rosier, larve verte à grise à tête orange) → Pyrale du buis Les pyrales du buis sont présentes sous forme d'oeufs, de larves (différents stades) et de papillons.
2358	2	a	Leur présence doit être détectée pour raisonner le choix des fongicides utilisés contre le Mildiou ou l'O ïdium.
1625	2	a	 La réceptivité de la vigne : Le stade lié à la réceptivité de la vigne vis-à-vis du Mildiou n’est pas encore atteint actuellement Maturité des œufs d’hiver Les œufs d’hiver ne sont pas encore à maturité.
1193	1	a	Très faible activité des pucerons cette semaine compte tenu des températures froides (cf graphique ci-contre).
2140	2	a	BS ég um es - N° 25 du 24/08/2011 Page 10 ROUILLE Contexte d’observations Les pustules de rouille observées la semaine passée restent bien présentes.
320	1	a	En présence de cet acarien le dessous des feuilles prend une teinte graisseuse métallique.
2042	2	a	Facteurs de risques régionaux • Les œufs d'hiver de mildiou ne sont pas mûrs.
146	0	a	Plante potagère cultivée pour ses feuilles comestibles par l'homme sous forme de légume: la batavia. Il existe plusieurs variétés de batavia.
644	1	a	Les BSV sont disponibles sur le site  (rubrique : Nos publications - Bulletin de santé du végétal) BSV CULTURES LÉGUMIÈRES DE PLEIN CHAMP Région Poitou-Charentes Bulletin n° 89 du 22 mai 2013 Page 5 / 6 Extrait du document : Sclérotinia (Sclerotinia sclerotiorum) : Comme la semaine passée, sous chenilles, il n’a pas été observé de symptômes.
2406	2	a	• Orthez : le risque mildiou demeure défavorable durant toute la durée de la simulation.Il remonte doucement pour s’approcher de la zone favorable en fin de simulation.
255	0	a	seigle semé après le 15 février
1075	1	a	On notera simplement une attaque de limaces grises sur 10% des plantules (secteur de Moulins) ainsi que quelques dégâts de taupins sur la même parcelle.
1108	1	a	Noctuelle : chenille défoliatrice Nématodes à Kystes : zone contaminée avec flétrissement du feuillage Directeur de publication : Jean-Pierre LEVEILLARD, Président de la Chambre régionale d’agriculture du Centre 13 avenue des Droits de l’Homme – 45921 ORLEANS Ce bulletin est produit à partir d’observations ponctuelles.
1950	2	a	Les tontes et surtout travaux mécaniques peuvent projeter des œufs de mildiou sur le jeune feuillage.
755	1	a	Attention, cependant aux dégâts dus à la mouche des semis.
1244	1	a	 Comment bien le reconnaître : Le charançon du bourgeon terminal a un corps noir brillant, des taches latérales blanches entre le thorax et l’abdomen et l’extrémité des pattes rousse.
684	1	a	Actuellement, nous pouvons observer la présence des premiers pucerons ailés dans les colonies de pucerons cendrés du pommier et de pucerons mauves du poirier.
1646	2	a	ALTERNARIA Oïdium sur scorsonère (photo : CA 45).
428	1	a	Pour mémoire, sur la période des 6 premières semaines de végétation assimilées à l'acquisition de 6 feuilles depuis la levée, le seuil de risque est fixé à 20% de plantes porteuses de pucerons.
543	1	a	- Pucerons : Les vols à la tour de succion de Lavannes-51 restent très modérés, malgré une légère augmentation des vols cette semaine, notamment pour le puceron des céréales.
15	0	a	culture d'arbres et d'arbustes
660	1	a	Tubercules atteints (Photo ACPEL) Doryphore (Leptinotarsa decemlineata) : Les doryphores adultes sont visibles sur les cultures de Ré depuis 3 semaines.
1364	1	a	Pensez aussi à vérifier la présence d’insectes auxiliaires ainsi que celle de momies de pucerons.
722	1	a	n POMMIER Tavelure : risque en fin de semaine Oïdium : favorable POIRIER Psylle : pression faible Feu bactérien : stade sensible TOUS FRUITIERS Pucerons – Chenilles : risque faible POMMIER- PRUNIER Hoplocampe : vol imminent N° 6 du 22 avril 2016 PHENOLOGIE Pommier : Poirier : Prunier : Cerisier : F2 POMMIER-POIRIER Tavelure Situation actuelle Suite aux contaminations du week-end de Pâques, les premières taches peuvent être visibles.
1219	1	a	Mouche du céleri : Aucune capture.
559	1	a	- Noctuelle défoliatrice : 1 parcelle du réseau (Juilly) signale la 1ère attaque de noctuelles localisées sur 20% des plantes , (chenille et déjections).
584	1	a	Département Commune MAISON-ROUGE 77272 MONTARLOT 77299 SIVRY-COURTRY ANDELU ABBEVILLE-LA-RIVIERE 91001 LES GRANGES-LE-ROI MONNERVILLE NAINVILLE-LES-ROCHES VALLANGOUJARD Précédent Stade Blé tendre d'hiver Début f loraison Orge d'hiver Début f loraison Blé tendre d'hiver Début f loraison Blé tendre d'hiver Début f loraison Orge de printemps Début f loraison Début f loraison Oui Orge de printemps Début f loraison Début f loraison Blé tendre d'hiver Oui Non Blé tendre d'hiver Début f loraison Variété KAYANNE NAVARRO MYTHIC ROSE (pois marbrés) KAYANNE KAYANNE KAYANNE KAYANNE KAYANNE Date de semis Labour Oui 16/03/2014 Oui 13/03/2014 Oui 21/03/2014 13/03/2015 Oui 12/03/2014 13/03/2014 14/03/2014 09/03/2014 13-mars Pucerons verts : 87,5 % des parcelles ont des pucerons verts avec une augmentation des populations sans toutefois atteindre le seuil de nuisibilité.
79	0	a	Plante potagère cultivée pour ses feuilles comestible par l'homme sous forme du légume du même nom.
2127	2	a	BS ég um es - N° 25 du 24/08/2011 Page 18 ALTERNARIOSE Contexte d’observations Avec la fin de cycle prochaine des cultures de tomates, ce champignon, très opportuniste, va commencer à se généraliser sur les parcelles.
2026	2	a	Ces galles forment des bosselures sur la face supérieure de la feuille qui se traduisent par des tâches internervaires de couleur rouille sur la face inférieure.
2327	2	a	Maladies Des attaques de mildiou signalées sur certaines variétés d’iceberg.
1660	2	a	Septoriose généralisée sur vieilles feuilles une parcelle au stade 20-30 cm.
1967	2	a	Helminthosporiose fusiforme Pas de symptômes signalés cette semaine.
873	1	a	Framboise Framboise hors-sol • Pucerons : rare présence, sauf exception : à surveiller.
1522	2	a	A ce titre, des symptômes d’anthracnose sont observés dans le Sundgau et la Hardt.
2227	2	a	Oïdium Avec le retour de la chaleur de nouvelles pustules sont sorties, mais la maladie reste généralement cantonnée aux étages foliaires inférieurs et uniquement sur 30 % des parcelles du réseau.
1137	1	a	Les jeunes chenilles s'enfoncent dès l'éclosion à l'intérieur de la feuille et se nourrissent du parenchyme supérieur.
1259	1	a	Pucerons verts : Période de risque en cours.
1187	1	a	Les pucerons ne sont pas directement nuisi- bles à l’automne.
2103	2	a	• Oïdium La pression oïdium est plus importante cette semaine sur toutes les zones.
424	1	a	Le seuil de nuisibilité retenu est de 30 cicadelles par capture hebdomadaire.
1198	1	a	→ Charançon de la tige du chou : Ce charançon accompagne, voire précède l'arrivée du gros charançon de la tige, sa nuisibilité est considérée comme négligeable.
2408	2	a	: le risque mildiou, demeure dans la zone défavorable durant toute la période de Bergerac simulation.
199	0	a	Plante cultivée pour leur fleur (capsule) utilisée dans l'industrie comme plante médecinale. Les capsules contiennent des graines utilisées dans l'huilerie.
2250	2	a	• Oïdium De nouveaux dégâts sont signalés.
597	1	a	Décaler la date de semis, en céréales à paille ce qui permet de limiter la levée et la densité des adventices automnales (en particulier le vulpin).
1653	2	a	 Composition du réseau d’observations Au total, 7 parcelles ont été observées : Culture Type Scorsonère Industrie ROUILLE BLANCHE Lieu Mardié Sigloy St Benoit sur Loire St Denis de l’Hôtel Tigy Bray en Val St Martin d’Abbat Stade Couverture des inter- rangs Etat général Des pustules de rouille blanche sont observées sur la totalité des parcelles du réseau.
2176	2	a	 Oïdium : Statu quo.
1412	2	a	Quelle que soit la variété, le risque est faible si l’oïdium est cantonnée aux tiges ou bien se présente sous la forme d’1 feutrages blancs sur moins de 1 % de la surface foliaire .
695	1	a	Sur les fruits (verts ou mûrs), des bosses ainsi que des marbrures brunes très caractéristiques apparaissent.
2447	2	a	Graphique 1 : Evolution du nombre de plantes touchées par l’helminthosporiose sur l’ensemble de la campagne sur les F2 et F3 (uniquement sur les parcelles touchées trai- tées et/ou non traitées) et en comparaison avec 2012 En fin de campagne, l’helminthosporiose était bien présente dans les parcelles mais à un niveau moyen : 40% des F1 étaient touchées et 47% des F2.
815	1	a	• Doryphore En Lot-et-Garonne, des doryphores sont présents sur 4 ha, avec moins d'un individu pour 10 mètres linéaires de rang.
243	0	a	arbre fruitier à noyau cultivé pour son fruit la prune. Il existe différentes variétés de prune.
2060	2	a	• Mildiou : quelques attaques dans le 47 et 24.
73	0	a	Plante cultivée pour sa racine utilisée en industrie pour la fabrication des boissons.
579	1	a	De la levée paires de feuilles : 30 à 50 pucerons par plante ; 2.
859	1	a	"En touchant le sac d'écorce de pin, on constate un manque de cohérence et en ""grattant"" le substrat, on trouve des larves de cétoines, larves qui rappellent le ver blanc du hanneton (voir photo)."
2100	2	a	• Cladosporiose Aucun nouveau symptôme n'est signalé sur le réseau.
1329	1	a	Pucerons En Limagne, la présence sur foliole latérale a été repérée sur 4 des 5 parcelles du réseau ayant fait l’objet d’une observation pour ces parasites.
1849	2	a	le mildiou va se développer dans la plante (c’est l’incubation), puis va fructifier (sporulation) pour sortir et contaminer d’autres plantes.
1389	2	a	: Chambre d’Agriculture de la Corrèze du Végétal Noix Corrèze-Quercy-Périgord 2011 N°3, consultable sous  » ZI CANA – BRIVE LIMOGES CEDEX sandra.laval@gmail.com accueil@limousin.chambagri.fr Evaluation du risque : Le stade de réceptivité de l'anthracnose (Df) est maintenant atteint pour l'ensemble des variétés et en tout secteur de production.
1668	2	a	Oignon-échalote : Mildiou : Pas de nouveau cas.
2238	2	a	• Mildiou Aucun symptôme de mildiou n'a été observé dans les parcelle du réseau.
771	1	a	En raison de la hausse des températures, les populations d’altises restent importantes et peuvent occasionner de nombreux dégâts.
1088	1	a	 Etat du colza Stade boutons accolés (D1) Stade boutons séparés (E) Stade Colza vigoureux (sol profond, bonne vigueur des plantes, peuplement optimal, pas d’autres dégâts) Colza stressé ou peu developpé (climat stressant, déficit hydrique, peuplement trop faible ou trop important, vigueur faible des plantes, autres dégâts) 3 méligèthes par plante méligèthes par plante 1 méligèthe par plante méligèthes par plante Directeur de publication : Jean-Pierre LEVEILLARD, Président de la Chambre régionale d’agriculture du Centre 13 avenue des Droits de l’Homme – 45921 ORLEANS Ce bulletin est produit à partir d’observations ponctuelles.
891	1	a	Nombre total de papillon par parcelle Noctuelle du chou (Mamestra brassicae) Relevé du 23 avril Zone de Surtainville 1 SSS EEE RRR EEE III MMM UUU EEE GGG HHH EEE CCC LLL NNN AAA SSS MMM EEE RRR UUU TTT LLL UUU CCC Bulletin de Santé du Végétal – Cultures légumières Manche directement par mail, faites votre demande à l’adre sse mail suivante : ml.blanc.fredonbn@wanadoo.fr Bulletin de Santé du Végétal par mail : Si vous souhaitez recevoir le Evolution du risque : Les pluies et les températures fraîches ne sont pas favorables au vol des papillons.
1659	2	a	Alternaria et septoriose : le risque diminue avec des températures en baisse.
1894	2	a	La rouille continue de se développer (FREDON NPDC) Bulletin de Santé du Végétal Légumes N°29 du 1er octobre er octobre 2013 SCORSONERE Réseau : 2 parcelles Stade: 15 à 25 mm de diamètre Oïdium (Erysiphe cichoracearum) A Buire le Sec (62), 30% des plantes observées sont touchées par l’oïdium avec 20% de la surface foliaire atteinte.
344	1	a	La cochenille adulte pond de très nombreux œufs (1500 à 200) sous son bouclier.
1695	2	a	OïdiumOïdiumOïdiumOïdium Surveiller les variétés sensi- bles.
2016	2	a	[Tapez un texte] %10%20%30%40%50%60%70%80%90%100% % de parcelles atteintesNoteSeptoriose 0-10Septoriose F1Septoriose F2Septoriose F3 BULLETIN DE SANTE DU VEGETAL LORRAINE – GRANDES CULTURES BULLETIN N°27 – EDITION DU 25 MAI 2011 La nuisibilité de la cécidomyie orange se traduit parfois par l'avortement des grains attaqués ma is aussi plus insidieusement par de l'échaudage et par la production de grains dont le tégument est plus ou moins craquelé.
154	0	a	Ensemble de plantes cultivées pour leurs fleurs ou inflorescences comestibles par l'homme sous forme de légumes. L'inflorescence est la disposition des fleurs sur la tige.
764	1	a	Sur mâche, les dégâts de mineuses perdent de l’importance.
1751	2	a	Le graphique ci-contre présente uniquement les captures du puceron Rhopalosiphum padi (puceron potentiellement vecteur du virus J.N.O.
1050	1	a	Criocères : Il n’existe pas de seuil de nuisibilité clairement établi face aux larves des criocères (les lémas) mais les essais d’ARVALIS – Institut du végétal montrent qu’avec 10% de surface attaquée sur les F1, les pertes de rendement peuvent s’élever à près de 5 q/ha.
864	1	a	Sur certaines parcelles, on peut observer des foyers avec la formation de toiles sur la tête des plantes.
2151	2	a	Les sorties de taches devraient avoir lieu en fin de cette semaine si les conditions redeviennent favorables au mildiou.
1535	2	a	Septoriose : .
1904	2	a	Mildiou Du mildiou sporulent est présent à Calonne -sur-la-Lys (62) sur un parc venant d’être débâché.
316	1	a	REPRODUCTION DE CE BULLETIN AUTORISEE SEULEMENT DANS SON INTEGRALITE – REPRODUCTION PARTIELLE INTERDITE – page 3/10 Tomate Acariens Les températures actuelles sont favorables au développement des acariens sur tomates en particulier à cette période de l’année.
1249	1	a	BS léa g in eux - N° 19 NE PAS CONFONDRE LES CHARANÇONS Charançon de la tige du colza (Ceutorrhynchus.
461	1	a	 Punaises : Nezara viridula et Nesidiocoris (Cyrtopeltis) tenuis Il n’est pas observé de punaises Nezara.
1801	2	a	Le phoma est la maladie la plus fréquemment signalée cette semaine.
996	1	a	THRIPS Etat général Des thrips sont observés en petite quantité sur 2 parcelles d’oignons blanc botte à Sully sur Loire (45), sur une parcelle d’oignon semis maraîcher à Chanteau (45), ainsi que sur deux parcelles d’oignon semis grande culture à Gidy (45).
1312	1	a	Action pilotée par le Ministère chargé de l'agriculture, avec l’appui l’Office financier de national de l'eau et des milieux aquatiques, par les crédits issus de la redevance pour pollutions diffuses attribués au finance- ment du plan Ecophyto 2018.
186	0	a	Type de production intensive des cultures légumières et de certains fruits (petits fruits) destinés à la vente en frais.
1905	2	a	Mildiou : risque nul Pour le moment, cette maladie est absente des parcelles.
1845	2	a	Mildiou : Un cas de Mildiou déclaré a été observé sur le secteur de Commercy sur plusieurs plants avec des symptômes sur tige, feuille et fruit.
1569	2	a	 Page – N ° Oidium • Régime d’averses : toujours défavorable à l’oïdium.
701	1	a	- Puceron vert du prunier (provoque l’enroulement des feuilles et le dépérissement des jeunes pousses).
2317	2	a	Informations annexes • Mildiou : évolution des fréquences des parcelles touchées par le mildiou en Aquitaine (parcelles observées) Evolution des fréquences de parcel les touchées par le m ildiou 100% 80% 60% 40% 20% 0% 16 avril ) % ( 23 avri l 30 avril 7 mai 14 mai 22 mai 28 mai 4 juin 11 juin 18 juin 25 juin 2 juillet 9 juillet 16 juillet 23 juillet Parcelles de référence Témoins non trai tés Bulletin de Santé du Végétal Aquitaine – Viticulture N°16 – 23 juillet / 9 • Vers de la grappe : tableau présentant le nombre de pièges relevés et les captures pour la période du 16 au 23 juillet Zone Médoc Graves- Sauternais Blayais- Bourgeais Libournais Entre-deux- Mers Dordogne Lot-et-Garonne Landes Pyrénées- Atlantiques Captures d'Eudémis (entre le 16 et le 23 juillet) Nombre de pièges relevés Captures Dynamique de vol Captures de Cochylis (entre le 16 et le 23 juillet) Nombre de pièges relevés Captures Dynamique de vol Pas d'évolution + Pas d'évolution Pas d'évolution - - + + - 24 - + - - - Pas d'évolution Pas d'évolution + : en augmentation - : en diminution • Parcelles d’alertes (parcelles flottantes) : Rappel : vous pouvez à tout moment signaler et consulter des observations isolées (ravageurs, maladies, maladies du bois, dégâts climatiques) sur l’outil Web Alerte Vigne :  : le mardi 30 juillet Prochain bulletin Ce bulletin est produit à partir d'observations ponctuelles.
245	0	a	choux, racines ou tubercules cultivés pour être utilisés en alimentation animale comme fourrage. La distinction entre RTF et fourrage annuel n'est pas claire. Quand la plante entière est utilisée comme fourrage elle est classée dans fourrage annuel. (à vérifier)
1769	2	a	CER IS IER • Monilioses Les monilioses sont les principales maladies affectant la conservation des fruits à noyau.
2451	2	a	Momies de microhyménoptères : Faible niveau ( Moins de 0.2/feuille) Mildiou : Pas de tâches observées.
1816	2	a	• Mildiou : les conditions actuelles sont défavorables malgré les foyers recensés.
1020	1	a	Stemphylium Photo LCA Courgette Composition du réseau d’observations Culture Courgette Courgette Courgette Courgette Courgette Courgette Courgette Courgette Courgette Courgette PUCERONS Type Plein-champ Plein-champ Plein-champ, Bio Plein-champ, Bio Plein-champ Plein champ Plein-champ Plein-champ Plein-champ Plein-champ, Bio Lieu La Ville aux Dames (37) Veigné(37) Chitenay (41) Chitenay (41) Montlivault (41) St Claude (41) Tour-en Sologne (41) St Benoit (45) Guilly(45) Chanteau (45) Stade 6-8 feuilles Récolte Récolte Début récolte Récolte 2 feuilles Récolte Récolte Récolte Récolte Etat général On n’observe plus aucun puceron sur les parcelles du réseau.
866	1	a	La tête des plantes est couverte de mycélium qui bloque la croissance des futures cannes.
1701	2	a	Ces conditions annoncées seront toujours favorables au développement des mala- • Tavelure Observations Observations Observations Observations Des nouvelles taches ont été observées, suite aux contaminations du début du mois de mai.
241	0	a	Prairie ensemencée et composée de légumineuses fourragères et de graminée fourragère. Prairie utilisée en fauche ou en pâture produisant du foin et de l'ensilage. Prairie d'une durée de vie de 0 à 5 ans, donnant lieu a au plus 6 récoltes.
1397	2	a	Des pourritures peuvent venir se positionner sur ces tissus nécrosés.
954	1	a	N°3 – 20 février 2014 Les structures partenaires dans la réalisation des observations nécessaires à l'élaboration du Bulletin de santé du végétal d'Aquitaine Arboriculture fruitière sont les suivantes : Aquifruit, BIP, Cadralbret, CDA17, CDA 24, CDA 47, CETA de Guyenne, EPLEFPA de Ste Livrade-sur-Lot, FDGDON 47, FDGDON 64, FREDON Aquitaine, GARLANPY, Granlot, INVENIO, LDA 33, Les 3 domaines, Novagri, Rouquette, SCAAP Kiwifruits de France, SICA Castang, SYPRUSI, SYNPPA, UCA France Prune, UPF, UPI, Valprim Fruits à pépins Pommier Poirier • Stades phénologiques Pommier En Lot-et-Garonne, stade A « bourgeon d'hiver » dominant pour Granny, Golden, Chantecler, Gala et Breaburn ; stade B « début de gonflement » pour Pink Lady.
1930	2	a	Bulletin de Santé du Végétal Aquitaine-Limousin-Poitou-Charentes / Edition Haut-Poitou Vigne – N°06 du 18 mai 2016 2/7 Stade 15 (d’après Eichhorn et Lorenz (Crédit Photo : C. BORDEAU – FREDON PC) Les maladies  Le Mildiou :  Réceptivité de la vigne La vigne est réceptive.
758	1	a	Dégâts de thrips sur poireau.
1796	2	a	Les niveaux de risque septoriose issus des modélisations d’Arvalis-Institut du Végétal indiquent globalement un ni- veau faible pour les variétés très sensibles et sensibles se- mées tard et les variétés tolérantes et un risque moyen à fort pour les parcelles au stade « dernière feuille pointan- te ».
