853	1	a	• Acariens Situation sur le terrain Les populations d'acariens sont toujours présentes aussi bien en Lot-et-Garonne qu'en Dordogne.
1812	2	a	Hors réseau, le nombre de parcelles témoins non traitées atteintes par l'oïdium a doublé et représente 16% des sites IFV observés.
889	1	a	Thrips : Pour l’instant une seule parcelle dans le Val de Sa ire a des pièges bleus.
2021	2	a	En progression depuis la Feu bactérien Dégâts de Dégâts de Phytoptus pyri Phytoptus pyri Dégâts de Dégâts de Phytoptus pyri Phytoptus pyri Le feu bactérien Erwinia amylovora est une mala- Evolution du risque Evolution du risque Evolution du risque Evolution du risque La floraison est une période de forte réceptivité au feu bactérien.
788	1	a	Sur 1 parcelle de référence située dans les Sables, des chenilles d'Héliothis (stade L3) ont été observées.
2366	2	a	La surveillance des parcelles doit être maintenue et la gestion de la maladie doit être couplée avec celle du mildiou et de l'oïdium.
1347	1	a	Photo n°2: Pucerons sur feuilles (source: FEREDEC Bretagne).
1776	2	a	Avec la bais- se progressive des températures, il appa- raît de moins en moins de nouvelles taches de rouille.
673	1	a	 Utilisation d’écopièges en fin d’hiver/ début de printemps afin de piéger les chenilles à leur descente et/ou de pièges à phéromones en fin de printemps pour capturer les papillons (mâles).
1884	2	a	--- Fusariose des épis Le risque fusariose est lié à la conjonction de plusieurs facteurs et conditions : Episode météorologique propice : le risque est élevé avec plus de 40 mm de précipitations sur une période de -7/+7 jours autour de la floraison avec des températures supérieures à 18°C pour le groupe Fusarium graminearum ; Précédent : maïs, sorgho / céréales à paille ; Non labour ; Sensibilité variétale.
1201	1	a	N° 16 – 4 juin 2015 Champagne-Ardenne BETTERAVE page 2  Croissance : Poursuite d’une croissance très active, début de couverture du sol pour les parcelles les plus en avance Pucerons noirs : Peu d’évolution, toujours sous contrôle dans la majorité des parcelles Pégomyies : Quelques observations des premières larves en culture sans gravité actuellement Teigne : Première détection de chenilles    A RETENIR CETTE SEMAINE REMARQUE : Ce bulletin est produit à partir de 55 observations ponctuelles réalisées du 1 er au 3 juin 2015 (parcelles agriculteur), sur 31parcelles de betterave.
1643	2	a	OÏDIUM Etat général De l’oïdium est observé sur 2 des 7 parcelles du réseau : - St Martin d’Abbat : 2 petits foyers - Mardié : plusieurs petits foyers dans la parcelle (contamination plus importante en bord de parcelle).
1664	2	a	Directeur de publication : Jean-Pierre LEVEILLARD, Président de la Chambre régionale d’agriculture du Centre 13 avenue des Droits de l’Homme – 45921 ORLEANS Composition du réseau d’observations BS ég um es - N° 20 du 07/08/2013 Page 9 Culture Type Conv Batavia Conv Feuille de chêne rouge Conv Batavia Conv Batavia Conv Batavia Conv Batavia Conv Laitue beurre Feuille de chêne rouge Conv Feuille de chêne blonde Conv Laitue beurre Conv Conv Feuille de chêne rouge Bio Batavia Bio Batavia Batavia Conv Conv Batavia Lieu Environnement Plein champ Plein champ Plein champ Plein champ Plein champ Plein champ Plein champ Plein champ Plein champ Plein champ Plein champ Plein champ Plein champ Plein champ Plein champ Stade Pommaison Pré pommaison Pré pommaison 12-15 F 5-6 f Pommaison Pommaison Proche récolte Proche récolte Récolte Pommaison Pommaison Récolte MALADIES CRYPTOGAMIQUES (POURRITURE GRISE , SCLEROTINIOSE, MILDIOU) Etat général Les cultures sont saines.
1566	2	a	Arboriculture Région Risque en cours au 20 avril Risque prévisionnel au 20 avril pour la fin de semaine Outre-Forêt Plaine de Brumath Duntzenheim Kochersberg Piémont des Vosges Obernai - Saint Pierre Bergheim Sigolsheim Munwiller Tagsdorf Contamination en cours Grignoncourt Contaminaton en cours Estimation du risque tavelure selon le modèle Rimpro En vert, pas de risque En jaune, risque moyen à faible En orange, risque moyen à fort En rouge, risque optimal Chambre d’agriculture de région Alsace – 2 rue de Rome – CS 30022 Schiltigheim – 67013 STRASBOURG CEDEX Directeur de publication : J.P.
1634	2	a	Les suivis des projections d’ascospores de tavelure réalisés avec le capteur de type Burckard sur le site de Villenave-d’Ornon en Gironde et au moyen de lames sur le site de Ste-Livrade-sur-Lot en Lot-et-Garonne ont permis d'observer les premières projections dès la première semaine de février.
747	1	a	- Pucerons : L’activité des microhyménoptè- res parasitoïdes de pucerons et des champi- gons entomophtorales est importante dans les colonies.
1115	1	a	• Sésamies Le pic de vol de la seconde génération est passé.
804	1	a	Les adventices sont toujours présentes dans les parcelles de carottes.
12	0	a	Plante cultivée pour ses grains utilisés en alimentation animale. La plante est aussi utilisée comme fourrage.
731	1	a	Charançons Situation actuelle Hors réseau, les charançons ont été signalés ponctuellement en nombre.
1306	1	a	On observe des dégâts de cécidomyies des feuilles, aussi bien sur pommier que sur poirier.
442	1	a	Lin oléagineux Piégeage de thrips.
2355	2	a	Bulletin de Santé du Végétal Arboriculture Fruits transformés : Bretagne, Normandie, Pays de la Loire N° 06 du 12 Avril 2011 Suivi réalisé : Sur parcelles fixes : Bretagne (cid:1) 5 ; Normandie (cid:1) 19 ; Pays de la Loire (cid:1) 2 Sur parcelles flottantes : Normandie (cid:1) 3 ; Pays de la Loire (cid:1) 1 En Bretagne : les variétés pomme à cidre les plus a vancées : stade F3 les variétés de poirier les plus avancées : H En Normandie : les variétés pomme à cidre les plus avancées : stade F2 les variétés de poirier les plus avancées : G-H En Pays de la Loire : les variétés pomme à cidre le s plus avancées : stade E3 –F Pomm ier Stade F MALADIES Pomm ier Stade F2 Poirier Stade G Tavelure Il n’y a pas eu de pluie depuis la semaine dernière .
596	1	a	Directeur de publication : Jean-Pierre LEVEILLARD, Président de la Chambre régionale d’agriculture du Centre - 13 avenue des Droits de l’Homme – 45921 ORLEANS Action pilotée par le Ministère chargé de l’agriculture avec l’appui financier de l’ONEMA, par les crédits issus de la redevance pour pollution diffuses attribués au financement du plan Ecophyto Comité de rédaction : le groupe technique régional SBT adventice avec la participation de la CRA Centre, Arvalis, Cetiom, Axereal, CA28, CA41, CA18.
528	1	a	Bulletin de Santé du Végétal Aquitaine – Pépinière - Bilan 2013 - N°1 – 14 février 2014 - 7 / 14 • Cicadelles Observations I II III Nb observations sur 432 Cicadelles % 2,2 1 2,2 38 diagnostics (9% des observations) ont été réalisés sur 14 cultures différentes avec des attaques en moyenne assez graves.
2095	2	a	Type de culture Serre froide Serre froide Nombre de parcelles en cours d’observations 3 : Variétés de printemps 2 : Variétés remontantes Département Stade 13, 84 13, 06 Développement végétatif Récolte  Oïdium On observe la présence d’oïdium dans trois parcelles d’observation, avec 20 % de plantes touchées et un niveau d’attaque faible à élevé.
2144	2	a	GRAISSE Contexte d’observations La graisse est observée de manière sporadique sur plusieurs parcelles en Loir-et-Cher.
187	0	a	Plante potagère cultivée pour son fruit comestible par l'homme comme légume du même nom. Il existe plusieurs variétés de melon.
1854	2	a	La simulation du risque mildiou : comment ça marche ?
472	1	a	La présence de pucerons a été observée peu de temps après la plantation en nombre très faible.
212	0	a	agrume cultivé pour son fruit le pamplemousse. Le pamplemousse est consommé plutot comme fruit confit à cause de son gout acidulé et amer. Ne pas confondre avec le pomelo consommé en frais.
1797	2	a	Seuil de nuisibilité (pour les variétés sensibles) : - Au stade « 2 nœuds » : quand 20% des F2 déployées du moment présentent des symptômes de septoriose.
865	1	a	Ce ver se nourrit de bois mort et ne s’attaque pas aux racines, mais il détruit le support des radicelles rendant celles-ci inefficaces.
1263	1	a	Ces pucerons peuvent provoquer une crispation du feuillage mais n'occasionnent généralement pas de dégâts significatifs.
1809	2	a	• Oïdium : la vigne est toujours sensible et les conditions sont favorables à la dissémination.
23	0	a	Plante potagère cultivée pour ses feuilles (inflorescence) comestible par l'homme sous forme du légume du même nom.
60	0	a	Ensemble de plantes cultivées principalement pour ses grains comestibles par l'homme sous forme de farine ou de céréales. Les grains sont aussi utilisés en alimentation animale. Une fois la récolte effectuée une partie de la tige sert à l'alimentation animale sous forme de paille.
896	1	a	Noctuelle défoliatrice : Pour l’instant un seul piège à phéromone est instal lé à Surtainville.
1604	2	a	Oïdium Quelques symptômes.
1237	1	a	Les conditions de fin septembre ont été favorables aux vols de pucerons (températures clémentes et absence de pluie).
1365	1	a	 Pucerons : retour de conditions climatiques douces et ensoleillées, en conséquence, surveillez l’évolution des populations.
668	1	a	Elles sont posées sur les arbres au début des éclosions des chenilles de 1ère génération, à une trentaine de centimètre du sol.
1765	2	a	• Oïdium L'oïdium passe l'hiver dans les bourgeons à fleur sous forme mycélienne.
1492	2	a	• Septoriose: la forte augmentation des symptômes cette semaine sur les dernières feuilles dans les témoins non traités, est liée aux contaminations des pluies de fin avril - début mai.
2193	2	a	Autres maladies : Sclérotinia, Rhizoctone violet, Pourritures humides Les levées rapides ont évité des gros problèmes de rhizoctone.
1559	2	a	Symptômes de mildiou sur feuille et tige.
1391	2	a	Mildiou : diminution de la présence du mildiou à La Houssaye ( 100% des plantes contaminées en semaine 26 et 27 ; seulement 8% en semaine 28).
1802	2	a	 Rhizoctone Champignon du sol, le rhizoctone provoque des pourritures notamment sur les plantes proches de la récolte.
2136	2	a	Prévision Surveiller notamment l’oïdium et la rouille, après les pluies orageuses annoncées en fin de semaine.
1985	2	a	graph) : Koreli, variété tolérante est logiquement complètement saine, alors que des variétés sensibles comme Bermude ou Perfector présentent des pressions plus importantes : 30% des parcelles de Bermude présentent plus de 40% de F3 touchées par la septoriose.
698	1	a	 Enlever et détruire, si possible, les cocons de soies en hiver.
707	1	a	Ces auxiliaires entomophages parviennent maintenant à stabiliser voir même à faire régresser certaines populations de pucerons.
114	0	a	Plante cultivée pour ses grains comestibles par l'homme sous forme de céréales ou de farine. La tige de la plante est utilisée en alimentation animale comme paille.
813	1	a	Haricot • Héliothis, Noctuelles défoliatrices : vol d'Héliothis élevé cette semaine, surveillez vos parcelles !
1916	2	a	Pourriture blanche Quelques symptômes de pourriture blanche sont aussi observées à Hau- bourdin (59).
2088	2	a	Si l’oïdium est présent sur les feuilles, c’est la fréquence de feuilles atteintes à partir du stade épi 1 cm qui est le critère déterminant : - Quelle que soit la sensibilité de la variété, si présence de feutrages blancs sur moins de 1% de la surface, le risque de nuisibilité est faible.
1211	1	a	TOUS LES ALLIUM : Mouche mineuse du poireau : Des piqûres de nutrition sont toujours observées sur les brins de ciboulette en Vallée de Seine.
1654	2	a	Prévision températures la baisse des Les pluies et contribuent à la constitution de conditions favorables au développement de la rouille blanche.
2279	2	a	: Le risque mildiou, en zone favorable, passe en zone défavorable à partir du 15 juin et y Bergerac demeure jusqu’à la fin de la période de simulation.
1029	1	a	Directeur de publication : Jean-Pierre LEVEILLARD, Président de la Chambre régionale d’agriculture du Centre 13 avenue des Droits de l’Homme – 45921 ORLEANS BS ég um es - N° 20 du 07/08/2013 Page 10 PIEGEAGE DE LA MOUCHE DU CHOU Modélisation Le modèle SWAT (simulations à partir des stations météorologiques de Parçay Meslay (37), Tour en Sologne (41), Outarville (45), Gien (45), Férolles (45), et Déols (36)) indique que le 2ème vol est terminé dans tous les secteurs.
1057	1	a	Entre 3 et 10 feuilles du ma ïs : 500 pucerons (avec de nombreux ailés) par plante ou production de miellat sur les feuilles à proximité de l ’épi.
71	0	a	Ensemble de plantes cultivées pour leur racine utilisée dans l'industrie pour la fabrication des boissons. La racine  et les feuilles sont aussi comestibles par l'homme sous forme de légume.
578	1	a	Communes (Département) CANNES-ECLUSE (77) PEZARCHES (77) ABBEVILLE-LA-RIVIERE (91) Date Semis 8 avril 2 avril Stade Semaine 18 B3-B4 : 4 feuilles – 2 paires de feuilles B8 B6 : 6 feuilles – 3 paires de B6 feuilles B8 : 8 feuilles – 4 paires de feuilles B3-B4 Pucerons : Pucerons toujours présents : 100% des plantes porteuses de pucerons à PEZARCHES et ABBEVILLE-LA-RIVIERE et présence de crispations sur plantes à CANNES-ECLUSE (72%) et PEZARCHES (100%).
962	1	a	Le stade de sensibilité à la maladie est atteint pour de nombreuses variétés.
1212	1	a	Thrips : Aucun individu n’a été observé dans les fleurs des deux parcelles du Calvados.
953	1	a	La taille et la fertilisation doivent aussi être Larves de cochenille du cornouiller adaptées afin de ne pas créer de conditions favorables à leur développement.
94	0	a	Plante cultivée pour ses graines riches en lipides comestible par l'homme sous forme d'huile. Son tourteau est utilisé en alimentation animale. Il existe plusieurs variétés de colza oléagineux.
51	0	a	arbre cultivé pour son fruit la caroube destinée à l'alimentation animale.
1793	2	a	Le risque pour la septoriose est faible pour les variétés sensibles semées en décembre et les variétés tolérantes.
1923	2	a	Le stade « fermeture de la grappe » (L-33) annonce une forte baisse de sensibilité des grappes à l’oïdium.
890	1	a	Evolution du risque : les thrips ne reprennent une réelle activité de ponte et de nourriture que lorsque les températures sont supérieures à 13° C. OO IIGGNNOONN :: Suivi : Mont Saint Michel : 3 parcelles de bulbilles et 2 de semis Stades : - Bulbilles : 2 feuilles à début 3 ème feuille.
1479	2	a	Seuil de nuisibilité : ◦ Helminthosporiose : sur variété sensible, si plus de 10% des feuilles sont atteintes, • sur variétés tolérantes, si plus de 25% des feuilles sont atteintes.
773	1	a	 ’ Captures de cicadelles sur la semaine/piège 0 ≥ 1 et < 15 ≥ 15 et < 30 ≥ 30 et < 100 ≥ 100 % de parcelles 88% 12% 0% 0% 0% Sur les 59 pièges relevés cette semaine, 7 pièges ont capturé 18 cicadelles entre le 8 et le 15 novembre, soit une moyenne de 0,3 cicadelle par piège pour la semaine n°46.
234	0	a	agrume cultivé pour son fruit du même nom le pomelo. Ce fruit est vendu sous le nom de pamplemousse. Le pomelo au contraire du pamplemousse est consommé en frais.
1577	2	a	· Les traitements fongicides d’automne ne sont pratiquement jamais rentabilisés, sauf dans des situations exceptionnelles pour l’oïdium en cas d’attaques précoces sur variétés sensibles (comme c’est le cas cette année) ET de conditions climatiques favorables pendant une grande partie de l’arrière saison (températures douc- ces et hygrométrie élevée).
1087	1	a	BS éag eu x - N° 21 ’ Les méligèthes sont toujours très fortement présents dans les parcelles du réseau.
170	0	a	Plante cultivée pour ses fibres ayant plusieurs usages industriels.
717	1	a	A proximité des foyers de pucerons, sont déjà signalés des coccinelles adultes, des syrphes (adultes et œufs) et des micro-hyménoptères, parasites de pucerons.
499	1	a	Respectez la réglementation « abeilles » et lisez attentivement L’encadré en page 4 et la note nationale sur les abeilles du BSV n° 206 Nombre de parcelles Créées Observées Maïs 63 33 Tournesol 15 7 MAÏS Stade phénologique et état de la culture : Pyrale : le vol se poursuit et le nombre de captures est en augmentation par rapport à la semaine précédente.
1401	2	a	L’une dans l’Oise avec la Rouille, l’autre dans la Somme avec de la Ramulariose.
1739	2	a	• Bactériose : présence de foyers sur une parcelle en Lot-et-Garonne.
1410	2	a	Helminthosporiose Variétés tolérantes Variétés sensibles Organe Nb de parcelles renseignées Nombre de parcelles atteintes % de parcelles atteintes sur l’organe Fréquence d’at- taques au niveau de l’organe (%) Tendance par rapport à la précédente observation F1 F2 F = = = Observations Cf.
1499	2	a	Non défini pour le mildiou à ce stade.
2212	2	a	L252-1 à L252-5 du Code Rural) Vol à la Tour à succion de Lavannes-51 de Rhopalosiphum padi (vecteur de la JNO) Rho.padi 04 Rho.padi /11/2005 16/10/2005 21/10/2005 06/10/2005 01/10/2005 11/10/2005 06/09/2005 11/09/2005 16/09/2005 01/09/2005 26/10/2005 31/10/2005 21/09/2005 26/09/2005 Parcelles de céréale du réseau d’observation ayant dépassé le seuil d’intervention au 07/11/2005 Nb de semaines % de pieds touchés d'observation 3 16% 2 8% 3 10% 8% 20% 3 20% 3 4% 8% 5% 3 10% 2 8% 8% 6% Haussimont-51 Tilloy-Bellay-51 Sompuis-51 Aubilly-51 La Cheppe-51 Le Thour-08 Barby-08 Montlaurent-08 Autry-08 Poix-terron-08 Pavillon Sainte Julie-10 Arrentières-10 Essey les Ponts-52 Maladies - Oïdium : Une grande majorité des parcelles de blé et d’escourgeon semées en variétés non tolérantes (à l’exception de Charger, parfois atteint et qui semble confirmer la certaine dérive de tolérance à la maladie observée au printemps dernier) de notre réseau présente des symptômes d’oïdium.
1586	2	a	Oïdium : Repiquages observés sur jeunes pousses.
487	1	a	→ Acarien du tilleul (Eotetranychus tiliarum) Les populations d'acariens sont plus importantes ce mois ci.
318	1	a	C’est un acarien qui peut attaquer plus de 2000 espèces végétales.
13	0	a	Arbre cultivée pour son fruit à coque l'amande. L'amande riche en lipides est comestible par l'homme sous forme de fruit sec ou d'huile. L'huile d'amande est utilisée en comestique.
1736	2	a	Le marquage des chancres par une ficelle ou de la peinture est une bonne méthode pour une intervention ultérieure.
1730	2	a	(cid:2) Ruffec : Le risque mildiou demeure dans la zone très favorable durant toute la période de simulation.
1940	2	a	• Oïdium : premiers symptômes observés (hors réseau).
2240	2	a	Mildiou : Cette maladie est relevée dans une parcelle du Calvados sur 32% des laitues.
987	1	a	Poireau : thrips et graisse à surveiller.
1508	2	a	à du seuil d’interventi d’Or) ce qui est bien en deç Premières taches d’oïdium (FREDON Bourgogne) Araignées rouges Les conditions très peu poussantes de la semaine dernière ont été favorables à ce ravageur dans les parcelles concernées (Mâconnais, C ôte de Beaune).
252	0	a	Plante potagère cultivée pour sa racine comestible par l'homme sous forme de légume: le salsifi.
1469	2	a	Ils sont généralement dûs à des maladies du pieds (notamment ronds de piétin échaudage ou symptômes de piétin-verse).
1179	1	a	• Adventices : infestation forte dans les parcelles de Haricots.
1003	1	a	8 Salades ........................................................................................................................................ 9 Crucifères .................................................................................................................................... 9 Solanacées ................................................................................................................................. 11 Concombres ............................................................................................................................... 14 Piégeages des noctuelles, teigne et Tuta absoluta ..................................................................... 15 .
1014	1	a	Légumes d’industrie / Composition du réseau d’observations Au total, 14 parcelles ont été observées : Culture Type Haricot/flageolet Industrie Lieu Saint Denis de l’Hôtel (45) Bray en Val (45) Epieds en Beauce 1 (45) Epieds en Beauce 2 (45) Pruneville (28) Lutz en Dunois (28) Neuvy en Dunois (28) Viabon (28) Ozoir le Breuil (28) Terminiers (28) Mérouville (28) Terminiers (28) Guillonville (28) Sancheville (28) Stade Récolte Formation gousses/filets 1ère aiguillettes Début floraison Boutons floraux 2-3 feuilles trifoliées PUCERONS NOIRS Etat général D’importantes populations de pucerons sont observées sur les plus jeunes parcelles.
1485	2	a	Oïdium : non signalé 2.
1230	1	a	Cicadelle adulte Psammotettix alienus : Seuil de nuisibilité : Il n’y a pas de seuil précis applicable de la levée au stade 3 feuilles des céréales, mais l’expérience des années passées indique :  Risque nul : < 30 captures hebdomadaires sur piège jaune englué (21x29,7 cm A4) en culture.
1341	1	a	Observations Sitone du pois Les parcelles seront bientôt au delà du stade de sensibilité.
1441	2	a	Présence de bactériose (jambe noire) signalée dans une parcelle à Le Puiset (28).
1638	2	a	Erwinia (bactériose de la racine) sur une culture bio sous abri.
414	1	a	Agri 60 Charleston 74 x 35 (60) Verberie ITB 60 Magellan 10 21 (80) Beauquesne SA Charpentier Python (80) Chuignolles Phyteurop Rosalinda 10 (80) Hangest en Santerre Saint Louis Sucre Talentina 16 18 (80) Hornoy le Bourg Syngenta Isabella 19 (80) Laviéville Sana Terra Isabella (80) Ponthoile SRAL Picardie Python (80) Saisseval KWS Sophia 16 x 17 (80) Templeux le Guerard SVI-Ceta HTS Cactus (80) Thézy-Glimont Phyteurop Sarbacane Oïdium Cercosporiose Rouille Ramulariose Parasitisme : Les noctuelles défoliatrices reprennent un peu plus d’activité avec la hausse des températures, mais aucune des parcelles du réseau n’atteint le seuil de nuisibilité.
1959	2	a	Scorsonère Rouille blanche Des symptômes assez marqués de rouille blanche sont observables sur le secteur de Vron.
2304	2	a	Par conséquent, le risque de nuisibilité du piétin-verse pour les parcelles en risque agronomique moyen est faible cette année.
759	1	a	 Ravageurs Les pressions en ravageurs (pucerons, acariens, thrips) restent importantes.
894	1	a	Evolution du risque : Les pluies et les températures fraîches sont peu favorables aux vols des mouches.
659	1	a	Doryphore : Présence précoce des adultes et pontes en cours.
2349	2	a	Excepté les quelques situations avec des at- taques mildiou (mentionnées dans les précédents BSV) l’état sanitaire reste relativement sain.
1277	1	a	Carpocapse des prunes : les piégeages diminuent.
2163	2	a	Dans quelques situations des symptômes de bactériose sont notés (effet variétal et situation de bas de parcelles).
633	1	a	Des pucerons momifiés ont été observés dans 15 parcelles (8% des plantes avec présence).
1155	1	a	Réseau de piégeage - Surveillance Biologique du Carpocapse des Châtaignes ( Cydia splendana) - 2012 : Bulletin de Santé du Végétal Sud-Ouest – Ch âtaigne N°6 (Bilan 2012) – 29/01/2013 - Page 3 sur 9 REPRODUCTION INTEGRALE DE CE BULLETIN AUTORIS ÉE - Reproduction partielle autorisée avec la mention « Extrait du Bulletin de Santé du Végétal Châtaigne Sud-Ouest 2012 N°6, cons ultable sous  » Courbes des vols 2012, par région (comparaison des moyennes de captures/piège sur 2006 à 2011, 2011 et 2012): D’après ces données, les pics des vols se situent pour les trois régions entre les semaines 35 et 37 (du 27/08 au 16/09), soit environ 3 semaine en moyenne après le début des émergences (= début de captures significatives), pour s’achever fin septembre (arrêt des comptages semaine 39).
250	0	a	Ensemble de plantes potagères cultivées pour leurs feuilles comestible par l'homme sous forme du légume la salade. Les plantes non représentées directement par un individu skos sont à considérer comme membre de cet ensemble générique.
9	0	a	liane cultivée pour son fruit le kiwi
1935	2	a	Pour rappel, le stade de sensibilité à la tavelure est C-C3 pour le pommier et C3-D pour le poirier.
28	0	a	avoine semé après le 1er février, principalement de fin février à début mars.
191	0	a	Plante cultivée pour ses graines comestibles par l'homme sous forme de condiment la moutarde. Les graines sont riches en lipides dont on extrait de l'huile. La plante est aussi utilisée comme fourrage pour l'alimentation animale. Il existe plusieurs variétés de moutarde. La moutarde noire est une plante médecinale.
2019	2	a	• Oïdium : A surveiller.
158	0	a	Ensemble de plantes cultivées pour leurs tiges comestibles par l'homme sous forme de légumes.
491	1	a	Pucerons → Pucerons du rosier (principalement Macrosiphum rosae) Les populations de pucerons sont toujours très faibles et les dégâts observés sont relativement modérés.
856	1	a	• Acariens : signalements importants d'araignées rouges : surveillez l'évolution des populations !
636	1	a	Pucerons Des pucerons adultes ont été détectés sur 4 parcelles.
916	1	a	Evaluation du risque Le retour de la chaleur est favorable aux pucerons.
1611	2	a	Les stations METEO-FRANCE de BESANÇON, DORANS, MONTMOROT et SAINT-SAUVEUR sont mobilisées pour l’évaluation du risque mildiou avec Mileos®.
