2350	2	a	BSV n° 11 - 23 juin 2010 Page 2/2 Oïdium Sur les 97 parcelles de chardonnay du réseau SBT observées la semaine dernière, la situation sur feuilles a peu évolué.
925	1	a	Auxiliaire très polyphage : consomme plus de 40 espèces de pucerons.
2090	2	a	Ils sont également vecteurs du virus TSWV (Tomato Spotted Wilt Virus).
1428	2	a	L’oïdium est présent sur feuilles et sur fruits et peut provoquer d’importants dégâts sur des variétés sensibles.
1887	2	a	--- Fusariose des épis Les remarques faites sur le blé sont valables pour le triticale.
1527	2	a	• Oïdium Cette maladie a fortement diminué.
2287	2	a	• Rouille Botryt is sur jeune tige.
2432	2	a	AUTRES MALADIES : Des symptômes d’alternaria et de phoma sont signalés dans 2 parcelles du réseau .
1252	1	a	 ’ Les conditions climatiques des derniers jours ont aussi été très favorables aux vols du charançon de la tige du chou.
113	0	a	Plante potagère cultivée pour sa bulbe comestible par l'homme sous forme de légume du même nom. Plusieurs variétés d'échalotes existent.
1324	1	a	Certaines variétés de pêches et nectarines pourraient se récolter cette fin de semaine et être sensibles en ce moment.
1817	2	a	Bulletin de Santé du Végétal Aquitaine – Viticulture N°14 – 9 juillet / 9 Champignons parasites Information réglementaire : Les notes nationales résistances vigne 2013 sont disponibles sur le lien suivant : www.draaf.aquitaine.agriculture.gouv.fr rubrique protection des végétaux et sous rubrique notes techniques nationales ou directement sur le lien suivant : h ttp://draaf.aquitaine.agriculture.gouv.fr/IMG/pdf/note_technique_commune_Vigne_2013_vf_2013-03- 26_cle074f41.pdf • Mildiou Éléments de modélisation (source IFV) : Au cours de la semaine passée, le risque a diminué notamment en fin de semaine .
180	0	a	Plante cultivée comme fourrage pour les animaux. elle peut être consommé en vert ou après ensilage.
2121	2	a	• Mildiou Aucun cas signalé à ce jour.
1511	2	a	Dans les parcelles où les pluies contaminatrices n’ont pas été anticipées en fin de semaine dernière, il est nécessaire de mettre en place une gestion du risque mildiou.
1035	1	a	NOCTUELLES Etat général Il n’y a pas de nouvelles attaques.
1592	2	a	Pour les risques tavelure il est préférable de suivre la pluviométrie sur chaque exploitation.
2377	2	a	Cultures de plein champ Ail La saison a été marquée par une pression rouille significative notamment dans le principal bassin de pro- duction qu’est la Drôme.
1834	2	a	Pomme de terre  Mildiou Situation sur le terrain Globalement, sur les différents secteurs (Landes et Marmandais) , les parcelles sont saines.
568	1	a	Pois : Début du vol tordeuses, développement de l'Ascochytose.
2378	2	a	A noter également, quelques dégâts de mildiou à partir de mai.
495	1	a	Poitou-Charentes Bulletin de santé du végétal 1 Numéro 216 Mardi 23 juin 2015 ÉDITION GRANDES CULTURES MAÏS TOURNESOL TOUTES CUL- TURES Stade : 12 feuilles (12F), Pyrales : pic de vol en cours ou atteint, Sésamies : fin du vol première génération, Pucerons : à surveiller.
1747	2	a	Observations parasitaires : • Les viroses de type mosaïque du concombre, déjà présentes sur la parcelle de référence de Lapeyrouse-Mornay (26) restent stables.
1562	2	a	(Biologie et conditions favorables : voir paragraphe mildiou de la pomme de terre.)
1525	2	a	Autres observations Des maladies du pied sont encore observées : 1 cas de fusario- se (5% des pieds touchés), 4 cas de piétin-verse (8% des pieds touchés) et 6 cas de rhizoctone (10% des pieds touchés).
179	0	a	Plante cultivée pour son fruit comestible par l'homme sous forme de légume du même nom. Le fruit se compose de graines. Le fruit entier ou les graines sont consommés.
282	0	a	arbuste cultivé pour son fruit le raisin
2323	2	a	Maladies Maladies L’oïdium reste visible dans les abris sur l’ensemble de la région.
664	1	a	Rosiers ................................................................................................................ 13 Dahlias ................................................................................................................ 15 La chenille processionnaire du pin (Thaumetopoea pityocampa) .................. 15 .
1871	2	a	le BSV GC n°16 (disponible sur --- Oïdium Observations du réseau : Les taches sous forme d’hypersensibilité sont toujours notées sur les feuilles du haut à Rilhac-Rancon et quelques pustules sont dénombrées sur F3 et F4 à Le Grand Bourg.
1981	2	a	Cependant, on observe en Angleterre, une nouvelle race de rouille jaune très virulente présente notamment sur Oakley, Ambition.
405	1	a	Petite tordeuse des fruits – Cydia lobarzewskii Le vol a débuté semaine 18.
2117	2	a	Au printemps, d'autres décolorations de la feuille peuvent être confondues avec des taches d'huile de mildiou (phytotoxicité désherbant, oïdium, thrips …).
2114	2	a	A Météren (59), moins de 1 % des poireaux observés ont des symptômes de mildiou.
1986	2	a	Fusariose La majorité des parcelles sont en pleine floraison.
998	1	a	De plus, la présence d’aeolothrips, prédateurs de thrips, a été constatée sur quelques parcelles du réseau d’observation; il s’agit d’un prédateur efficace dont la taille fait environ le double de celle de sa proie.
1216	1	a	Puceron : Aucun individu n’a été observé dans les deux parcelles du Calvados.
541	1	a	MAÏS - Pyrales : confirma- t ion du débu t de vol.
693	1	a	Sous celles-ci, on peut parfois observer un feutrage blanc-grisâtre caractéristique.
1549	2	a	Moniliose Contexte d’observations 6 sites d’observations: - 5 jardins amateurs (dans le 37, le 18 et le 45) - 1 verger amateur (45) Etat général Cette maladie est présente sur cerisier mais également sur pêcher, abricotier, prunier et amandier.
1689	2	a	Fusariose base tige : sur 14 parcelles observées, des symptômes sont signalés sur deux parcelles dans l’Orne et en Seine-Maritime.
2419	2	a	MALADIES FOLIAIRES : Le complexe helminthosporiose - taches brunes évolue fortement sur les parcelles d’es- courgeon du réseau, avec 95 % des parcelles touchées sur F3 définitive, dans 90% des par- celles sur F2 et dans 50% des parcelles sur F1.
924	1	a	Pucerons Quelques pucerons égarés sont signalés sur 3 parcelles du réseau.
646	1	a	Semaine Parcelle : 19 Nombre de teignes pour 2 pièges delta relevés Exemple de piège avec capsule de phéromones (Photo Benoît VOELTZEL – CA17) Autres problématiques : Les relevés effectués n’indiquent pas de présence de thrips, de rouille… Les BSV sont disponibles sur le site  (rubrique : Nos publications - Bulletin de santé du végétal) BSV CULTURES LÉGUMIÈRES DE PLEIN CHAMP Région Poitou-Charentes Bulletin n° 89 du 22 mai 2013 Page 2 / 6 Cette rubrique est rédigée à partir des observations réalisées dans le contexte primeur de l’île de Ré et d’une parcelle de la Vienne.
1286	1	a	• Tordeuse orientale et cochenille blanche du mûrier Voir le paragraphe « toutes espèces ».
1159	1	a	Larve de zeuzère dans un rameau SESIE Synanthedon castaneae Eléments de biologie : La sésie est un insecte de l'ordre des lépidoptères dont la larve creuse des galeries sous- corticales profondes atteignant 20 à 25 mm et entamant la couche libérienne.
1956	2	a	On observe un flétrissement, puis un dessèchement et mort de la plante.
1825	2	a	- Dans le cas de l’alternariose, les taches, de taille variable, ont un contour bien net, elles ne présentent jamais de feutrage gris à la face inférieure des feuilles.
2187	2	a	 - | 12 BULLET IN N°13 - ED IT ION DU 13 JU ILLET Larve de Cochylis à son dernier stade de développement au 11 juillet – FREDON Lorraine Glomérule abritant une nymphe de Cochylis au 11 juillet – FREDON Lorraine - | 12 BULLET IN N°13 - ED IT ION DU 13 JU ILLET ld iou Situation actuelle : La pression mildiou est comparable à la semaine passée avec la présence sur le feuillage de taches anciennes en nécrose mais aussi de taches fraîches sporulantes.
2203	2	a	p1 Carotte, céleri, chou, poireau, radis; épinard, pomme de terre ………… p2 CULTURES SOUS ABRI Carotte …………………………………………………………………………….. p2 Salade, Chou, Tomate, pomme de terre, fraise …...……………………….. p3 Cultures de plein champ Ail Zone Drôme centre La rouille est toujours présente mais en régression avec 10 à 20 % des plantes touchées avec une inten- sité de 1.
238	0	a	arbre fruitier cultivé pour son fruit à pépin la pomme. Il existe plusieurs variétés de pommes.
1652	2	a	SCLEROTINIOSE Etat général Sur quelques parcelles et de façon anecdotique, on retrouve des dépérissements de concombres provoqués par le Sclerotinia sp.
1421	2	a	1 parcelle sur 27 porte des symptômes de fusariose de la tige Pour les observations à réaliser début montaison, on consi- dère que le risque est très élevé à partir de 35 % de tiges atteintes par le piétin verse.
1546	2	a	Le risque oïdium augmente toutefois dans l’est de la région.
2338	2	a	Monilioses : Période à risque en cours.
2041	2	a	A l'heure de la rédaction de ce bulletin, sur les lots de feuilles mis à l'étuve ce lundi, aucune germination des œufs de mildiou n'est encore observée.
1438	2	a	Afin de suivre l’évolution des races de mildiou vis -à-vis des résistances éventuelles aux traitements de semences et/ou l’apparition de nouvelles races, merci de signaler les parcelles de tournesol ayant au moins 5 % de plantes attaquées ou avec un foyer d’attaques important au tél. ou à l’adresse BSV-GC@fredonpc.fr (cf.
1319	1	a	A ne pas confondre avec les dégâts de cèphe : bouts de pousses qui se courbent en crosse et qui se dessèchent avec présence à la base de la crosse de piqûres disposées en hélice.
2374	2	a	L’oïdium a été lui très problématique avec des symptômes souvent généralisés sur la parcelle et qui ont réduit la durée de récolte des cultures (et donc les rendements).
687	1	a	Elles seront retirées et brûler en début d’hiver.
123	0	a	plante cultivée pour ses graines utilisées pour l'alimentation animale.
920	1	a	Evolution du risque Comme le puceron cendré sur pommier, il provoque l’arrêt de croissance des pousses et l’enroulement des feuilles.
1857	2	a	Ces pluies ont permis au mildiou de redémarrer après le « blocage » lié à la sécheresse du début du mois.
147	0	a	Plante potagère cultivée pour ses feuilles comestibles par l'homme sous forme de légume: Feuille de chêne. Il existe plusieurs variétés de feuille de chêne.
411	1	a	 Le seuil de nuisibilité est atteint lorsque 50% des plantes portent des morsures, des déjections et des chenilles Nématode à kyste : Malgré l’utilisation des variétés tolérantes, on constate toujours des parcelles qui présentent des symptômes.
279	0	a	Plante tropicale cultivée pour son fruit comestible par l'homme sous forme de plante aromatique:  la gousse de vanille. Les gousses sont aussi utilisées dans la parfumerie sous forme d'extrait.
2124	2	a	Informations générales • Plusieurs cas de bactérioses et/ou champignons pathogènes ont été observés sur les parcelles du réseau : surveiller bien vos parcelles dites à risques (plantes stressées, excès d’eau et mauvais drainage du sol).
1533	2	a	Septoriose La maladie a bien progressé sur les feuilles hautes : 36% des parcelles suivies cette semaine présentent des symptômes sur F2.
1225	1	a	• Charançon du bourgeon terminal (CBT) Depuis les dernières observations, - les captures de CBT se maintiennent sur l'ensemble du réseau.
1725	2	a	Les BSV sont disponibles sur le site  (rubrique : Nos publications - Bulletin de santé du végétal) BULLETIN DE SANT É DU V ÉG ÉTAL ÉDITION TABACULTURE Bulletin n° 34 du 21 Août 2013 Page 5 / 7 Modélisation mildiou Positif® Tabac* Suite à une interrogation du modèle Positif® Tabac* le 19août 2013.
1043	1	a	BULLETIN DE SANTE DU VEGETAL DU LANGUEDOC-ROUSSILLON Grandes Cultures Semences – N° 3 22 octobre 2013 L’essentiel Colza : * Maladie : - Aucun sympt ôme signalé * Ravageurs : - Grosses Altises des crucifères: Des captures sont notées dans l ’ouest Audois (7 adultes) et sur le secteur de Barjac (1 adulte) - Charan çon du bourgeon terminal (CBT): Prem ières captures dans l ’ouest Audois (secteur 1) - Limaces : aucun dég ât noté - Tenthrèdes de la rave : sur 70% des parcelles sont notées avec des dég âts * Adventices : Levées de repousses de céréales sur tous les secteurs.
828	1	a	Carpocapse des pommes (Cydia pomonella) Situation actuelle : Le légère vol est en diminution par rapport à la semaine précédente (fin sans doute prochaine du vol de 1ère génération).
1738	2	a	Autres observations • Bactériose Des symptômes de Bactériose sont observés sur 25,5 ha de parcelles de Tomate, dont 19 ha avec seulement quelques taches isolées et 6,5 ha, en Lot-et-Garonne, avec des 1 ers foyers.
1047	1	a	Taupins : sur 7 parcelles observées, l’une d’entre elles présente des traces de dégâts.
818	1	a	Les dégâts occasionnés sont rarement importants car la chenille ne peut évoluer que dans des arbres dépérissant dans lesquels la sève circule mal.
2303	2	a	Page 2 /4 Ce bulletin est une publication gratuite, réalisée avec la collaboration de : ARVALIS-Institut du végétal – Agrial – Agri Demeter - Appro Vert – CA14- CA27 - CA50 - CA61 - CA76 - Cap Seine - Chapellière - Coopérative de Belleme – Coopérative Creully – D2N - les DRAAF - FREDON HN - GRCETA de l ’Evreucin - Guilloux - Int erface Céréales - Lalande - Lepicard Agriculture - Leriche – Letico - Noriap - Piednoir - Sévépi - SRAL Basse-Normandie - Synergie Bulletin de Santé du Végétal Normandie  Grille d ’évaluation du risque parcellaire piétin-verse (source : ARVALIS – Institut du végétal) Potentiel infectieux du sol Labour Non labour Non labour Labour Labour Non labour Indifférent Travail du sol et cultures précédentes / anté précédentes Milieu physique Type de sol Craie Limon battant Autres sols Effets date de semis et variété Précoce * Date de semis Tardive* Note Précédent / Antéprécédent Votre parcelle Blé / Blé Blé / Blé Blé / autre Blé / autre autre / Blé autre / Blé autre / autre + + + Sensibilité variétale 2 Note GEVES 1 et Note 3 et 4 -1 Note 5 Note 6 et plus -2 Note totale (niveau de risque) = * Basse-Normandie, hors Sud-Est de l ’Orne : Semis précoce avant le 1er novembre, semis tardif au-del à du1er novembre Haute-Normandie et Sud-Est de l ’Orne : Semis précoce avant le 25 octobre, semis tardifs au-del à du 25 octobre.
2433	2	a	3 parcelles présentent sont touchées par du mildiou (contaminations secondaires).
1183	1	a	• Noctuelles terricoles : Aucune capture de noctuelles n’est effectuée dans les pièges.
343	1	a	LECANINE DU CORNOUILLER (Eulecanium corni) Rappels biologiques Cette cochenille hiverne au deuxième stade larvaire.
84	0	a	Ensemble de plantes potagères comestibles par l'homme sous forme de légume du même nom. En fonction de la variété de chou, la partie de la plante consommable est différente.
1618	2	a	Pomme de terre Sur tous les trois sites observés cette semaine le feuillage a été défané ou bien grillé par le mildiou ou l’alternaria.
1720	2	a	Des symptômes de mildiou ont été signalés fin de semaine 33.
2177	2	a	Nécrose en fin de cycle (faces supérieure et inférieure de la feuillle)  Oïdium Il est présent en bordure de Gironde, à Saintes et Saint Preuil.
1762	2	a	MILDIOU Avec l’infestation de mildiou sur feuillage, plus marquée cette année fin août/début septembre, 20% des parcelles observées ont entre 1 et 2% de tubercules atteints.
2379	2	a	Le mildiou a bien été maitrisé du- rant les périodes de pression plus forte (printemps et septembre).
2126	2	a	Pour ces 2 bactérioses, leurs croissances optimales ont lieu à des températures assez élevées (à partir de 25°C) et humides : de fortes averses ou des orages sont très propices à leurs apparitions.
2314	2	a	Bulletin de Santé du Végétal Aquitaine – Viticulture N°16 – 23 juillet / 9 Dynamique du risque (par rapport au BSV 15) ZONES Risque potentiel de contaminations mildiou calculé Très faible / Faible * Médoc - Très faible / Faible * Graves/Sauternais - Très faible / Faible * Blayais-Bourgeais - Très faible / Faible * Libournais - Très faible / Faible * Entre deux Mers - Très faible / Faible * Dordogne - Très faible / Faible * Lot et Garonne - Landes - Faible Faible / Moyen * Pyrénées-Atlantiques Pas d'évolution - : risque en diminution + : risque en augmentation * : voir carte ci-contre pour le détail des zones concernées Observations - Sur les parcelles de référence : Des symptômes sur feuilles et sur grappes restent visibles ma is peu de nouvelles taches sont signalées .
100	0	a	Plante potagère cultivée pour son fruit et sa fleur comestible par l'homme sous forme de légume la courgette, la fleur de courgette.
965	1	a	Le Pou de San José passe l’hiver sous forme de larve de premier stade (de couleur jaune) sous un bouclier blanc circulaire.
863	1	a	Des femelles hivernantes (Tetranychus urticae) sont observées sur 2 parcelles.
628	1	a	Les premiers dégâts de taupins et de limaces ont été signalés dans les parcelles.
2278	2	a	• AQUITAINE – LIMOUSIN - AUVERGNE : • Orthez : Le risque mildiou demeure très favorable durant toute la durée de la période de simulation.Le risque d’épidémie de mildiou déjà très élevé , est en progression avec les épisodes pluvieux du 6 au 11 juin.
603	1	a	 Pour la Cicadelle des grillures, le seuil de nuisibilité est de 100 larves pour un échantillon de 100 feuilles observées.
1943	2	a	• Mildiou : taches isolées, sur une grande partie de l'Aquitaine.
1133	1	a	- Pucerons en progression sur 15% des surfaces mais en équilibre avec de nombreux auxiliaires.
682	1	a	- Puceron noir du cerisier.
1033	1	a	 Noctuelle observée à Ouvrouer les Champs (45).
653	1	a	Pour ce second relevé, on n’enregistre pas d’activité de la teigne.
2139	2	a	ROUILLE BS ég um es - N° 25 du 24/08/2011 Page 7 Contexte d’observations La rouille ne se développe pas.
531	1	a	11% 1,7 3, Bulletin de Santé du Végétal Aquitaine – Pépinière - Bilan 2013 - N°1 – 14 février 2014 - 5 / 14 Choisya (7) Photinia (7) Buxus (5) Ficus carica (3), Pittosporum (3), Prunus persica (3), Viburnum tinus (3) Abutilon (2), Lavatera (2), Malus domestica (2) Ceanothus (1), Chaenomeles (1), Evonymus (1), Olea (1), Phillyrea (1), Plumbago (1), Prunus caucasica (1), Prunus laurocerasus (1), Prunus pissardii (1), Pyrus communis (1), Salix (1) Faits marquants : de fortes populations de chenilles de différentes espèces (noctuelles, tordeuses, pyrales) résultant de la succession de plusieurs générations du printemps à l’automne, favorisée par le climat globalement doux et humide.
1560	2	a	Rappel : les repousses sur les tas de déchets et dans les champs sont des réservoirs pour le mildiou.
757	1	a	Avec le maintien des fortes températures, les populations de thrips continuent d’être importantes.
2315	2	a	Dans le secteur de Saint Emilion, quelques taches de mildiou sont recensées sur des parcelles humides et vigoureuses (Source : CIC).
881	1	a	Dioryctria sylvestrella est un lépidoptère dont la chenille vit en xylophage aux dépends des pins (Pinus nigra, P. sylvestris, P. pinaster,… et quelques fois Epicea).
2154	2	a	A Guilly (45) en agriculture conventionnelle, un foyer de mildiou est apparu cette semaine sur oignon blanc botte.
1713	2	a	• Virus Des symptômes de virus sont observés sur le réseau de surveillance.
1202	1	a	TEIGNE L’observation des premières chenilles de teigne a été signalée sur le site de Rhèges avec 2% de plantes atteintes.
254	0	a	seigle semé avant le 15 février
2052	2	a	Inoculum d’automne L’estimation de l’inoculum d’automne permettra d’ajuster au mieux la lutte anti- tavelure 2016.
394	1	a	BULLETIN DE SANTÉ DU VÉGÉTAL – GRANDES CULTURES N° 10 DU 26 NOVEMBRE 2015 – Page 1/3 Directeur de publication : Jean-Louis CAZAUBON Président de la Chambre Régionale d'Agriculture de Midi-Pyrénées BP 22107 – 31321 CASTANET TOLOSAN Cx Tel 05.61.75.26.00 – Fax 05.61.73.16.66 Dépôt légal : à parution ISSN en cours • Charançon du bourgeon terminal (adulte) Le niveau des captures de CBT poursuit sa baisse cette semaine encore.
1255	1	a	Si près d’un tiers des parcelles atteignent le stade D1, date de début de sensibilité face aux méligèthes, il reste encore un tiers des parcelles qui ne dépasse pas le stade C1.
1939	2	a	Pas de développement de mildiou pour le moment.
880	1	a	Coccinelles Auxiliaires Adultes Larves Œufs Syrphes Adultes Larves Œufs Chrysopes Acariens prédateurs Cécidomyies (Feltiella, Aphidoletes) Momies pucerons, parasitoïdes Hyménoptères parasitoïdes - vols Pleine terre Hors sol Présence d’adultes Abris Pas de présence relevée Faibles populations Populations moyennes Fortes populations Ravageurs Erinoses/ phytoptes RAVAGEURS Pleine terre Alnus cordata Mineuse du marronnier Pas de vol détecté Hors sol Abris Pyrale du Buis Tordeuse de l’œillet Buxus- présence de chenilles dans certaines parcelles Quelques piégeages dans une entreprise Pas de vol détecté Bambou Page 1 / Cossus Processionnaire du pin Pyrale du tronc Zeuzère Cochenilles Mollusques Otiorhynques Pucerons Pucerons Pas de vol détecté Pinus pinaster Pas de vol détecté Catalpa, Morus,… Nombreuses cultures Pucerons lanigères Psylles Nombreuses morsures (Syringa, V tinus, …) Salix Malus Elaeagnus N°20 du 14 novembre 2014 PYRALE DU TRONC : DIORYCTRIA SYLVESTRELLA Une attaque de pyrale du tronc sur Pinus pinaster a été notée dans une entreprise sur cette fin de saison.
1880	2	a	1 parcelle est indemne de septoriose sur les 3 dernières feuilles : Saint-Priest-Taurion.
240	0	a	prairie ensemencée exclusivement de légumineuses fourragères. Prairie fauchée. Prairie d'une durée de vie inférieure à 10 ans et supérieure à 1 an, en moyenne 5 ans
1105	1	a	 Le seuil est atteint lorsque 10% de plantes sont touchées par des dégâts chenilles.
2407	2	a	: comme les 2 dernières semaines, le risque mildiou demeure dans la zone défavorable durant Agen toute la durée de la période de simulation.
2106	2	a	BULLETIN DE SANTÉ DU VÉGÉTAL – MELON N°20 DU 09 AOÛT 2012 – Page 2/3 • Mildiou Quelques nouveaux faibles symptômes de mildiou sont signalés sur des parcelles.
1275	1	a	BULLETIN DE SANTÉ DU VÉGÉTAL – ARBORICULTURE N° 16 DU 5 JUIN 2012 – Page 7/8 • Acariens Évaluation du risque : On observe assez peu d'acariens en parcelles.
2233	2	a	• Cladosporiose De nouveaux symptômes sont observés en début de période.
697	1	a	A Tours, la maladie a fortement progressé et de très nombreux rosiers sont recouverts d’un feutrage blanc.
1393	2	a	Les conditions climatiques de la semaine, humidité et température située entre 15 et 20°C, devraient favorisées le développement du mildiou.
1524	2	a	Helminthosporiose Les données issues du réseau d’observation indiquent cette semaine une accélération dans l’apparition de la maladie, particulièrement dans les zones sensibles de la bordure rhénane.
1285	1	a	• Tordeuses de la pelure (Capua) Sur notre réseau de pièges, nous observons une baisse d'intensité du vol.
661	1	a	Surveiller vos cultures Tous fruitiers Pucerons Etat général Les pucerons continuent leur progression sur l’ensemble des espèces fruitières : - Puceron cendré du pommier et maintenant puceron vert non migrant.
946	1	a	Par ailleurs, ces chancres sont des sites privilégiés pour certains ravageurs comme la sésie du pommier, la cochenille farineuse.
937	1	a	On voit aussi beaucoup de pucerons morts ou parasités, ainsi que des auxiliaires.
997	1	a	Photo : aeolothrips prédateur de Thrips (M.
1658	2	a	Directeur de publication : Jean-Pierre LEVEILLARD, Président de la Chambre régionale d’agriculture du Centre 13 avenue des Droits de l’Homme – 45921 ORLEANS ROUILLE Etat général Les parcelles du réseau d’observation restent saines.
1337	1	a	baris Méligèthes : toujours une pression faible mais la vigilance s ’impose Les méligèthes ont été piégés dans les cuvettes parfois en grande quantité.
78	0	a	plante potagère cultivée pour son bourgeon comestible par l'homme sous le forme du légume du même nom.
645	1	a	Test « Blue Plate » du Ctifl positionné devant l’ouverture des chenilles (photo ACPEL) Les BSV sont disponibles sur le site  (rubrique : Nos publications - Bulletin de santé du végétal) BSV CULTURES LÉGUMIÈRES DE PLEIN CHAMP Région Poitou-Charentes Bulletin n° 89 du 22 mai 2013 Page 6 / 6 Abonnez-vous gratuitement aux différentes éditions Des BSV Poitou-Charentes et recevez les régulièrement dans votre boite mail Action pilotée par le ministère chargé de l’agriculture, avec l’appui financier de l’Office National de l’Eau et des Milieux Aquatiques (ONEMA), par les crédits issus de la redevance pour pollutions diffuses attribués au financement du plan Ecophyto 2018.
