426	1	a	Dans les situations proches de la floraison des arbres fruitiers et des parcelles légumières, lors de la pleine floraison, ou lorsque d'autres plantes sont en fleurs dans les parcelles (semées sous couvert ou adventices), utiliser un insecticide ou acaricide portant la mention « abeille », autorisé « pendant la floraison mais toujours en dehors de la présence d’abeilles » et intervenir le soir par température <13°C (et jamais le matin) lorsque les ouvrières sont dans la ruche ou lorsque les conditions climatiques ne sont pas favorables à l'activité des abeilles, ceci afin de les préserver ainsi que les autres auxiliaires des cultures potentiellement exposés.
47	0	a	Plante potagère cultivée pour ses fleurs (inflorescence) comestible par l'homme sous forme de légume.
903	2	a	Seuil de nuisibilité à partir du stade 2 nœuds :  Variétés sensibles et très sensibles : si plus de 20% des F3 présentent des symptômes de septoriose ;  Variétés peu sensibles : si plus de 50% des F3 présentent des symptômes de septoriose.
52	0	a	Plante cultivée pour ses graines riches en lipides comestible par l'homme sous forme d'huile
667	1	a	Bulletin de Santé du Végétal Légumes N°15 du 3 juin juin 2014 ADVENTICES La démonstration désherbage mécanique des poireaux (4 outils différents en démonstration) initiale- ment prévu le 4 juin 2014 aura lieu demain Samedi 7 Juin à 15h30.
346	1	a	Risque faibleRisque élevéRisque faibleRisque élevé Bulletin n°14 du 26 mai 2009 Les tordeuses volent dès que la température moyenne dépasse 18°C.
1014	2	a	soit la parcelle se situe dans un environnement sain   La sensibilité variétale et le suivi du nombre de génération de mildiou sont de bons indicateurs pour connaître le début de la période à risque pour cette maladie.
329	1	a	Développement d’adventices.
633	1	a	Vols pucerons de la pomme de terre 04-04 11-04 18-04 25-04 02-05 09-05 16- Tour à succion (Lavannes) : Le Myzus persicae poursuit sont vol avec modération.
726	2	a	Attaque de rhizoctone du sol sur Charlotte à Baldenheim.
438	1	a	• Tordeuses : premiers piégeages d'Eudémis et de Cochylis en Dordogne et Gironde.
460	1	a	Mouche du chou (Délia radicum) RESEAU DE SURVEILLANCE BIOLOGIQUE DU TERRITOIRE 2012 PAYS DE LA LOIRE > > > ° Les piégeages sont stables par rapport à la semaine 26.
515	1	a	(Pour rappel, il n’ pas eu de troisième vol dans les autres zones de Moyenne Vallée du Rhône).
1031	2	a	Photo 2 : M Merieau FREDON Centre Photo 1 : FDGDON37 MILDIOU Etat général Le mildiou est toujours signalé sur quelques parcelles d’Indre et Loire (Ville aux Dames) et du Loiret (Guilly).
399	1	a	Bulletin de Santé du Végétal Aquitaine – Bilan Pomme de terre N°27 – 18 décembre / 8 Ravageurs • Taupins : pression plus importante qu'en 2013 Contexte Depuis plus d'une quinzaine d’années, une recrudescence des dégâts de taupins est notée dans de nombreuses cultures de plein champ, dont la pomme de terre.
381	1	a	Cécidomyie des poirettes Ce moucheron pond généralement plusieurs œufs dans un bouton floral.
287	0	a	Le Haricot, ou Haricot commun (Phaseolus vulgaris L.), est une espèce de plantes annuelles de la famille des Fabaceae (Papilionacées), du genre Phaseolus, couramment cultivée comme légume. On en consomme soit le fruit (la gousse), haricot vert ou « mange-tout », soit les graines, riches en protéines. Le terme « haricot » désigne aussi ces parties consommées, les graines (haricots secs) ou les gousses. Source Wikipédia
558	1	a	Chenille bourrue Rappel du seuil d’intervention : au moins 15 % des ceps avec au moins un bourgeon attaqué Il est encore un peu tôt pour bien visualiser les symptômes, les 1ères observations débuteront la semaine prochaine Directeur de publication : Jean-Pierre LEVEILLARD, Président de la Chambre régionale d’agriculture du Centre 13 avenue des Droits de l’Homme – 45921 ORLEANS Ce bulletin est produit à partir d’observations ponctuelles.
423	1	a	Bulletin de Santé du Végétal Nouvelle-Aquitaine / Edition Aquitaine Arboriculture fruitière – N°22 du 17 novembre 2016 5/9 Piégeage du carpocapse des prunesRéseau Aquitaine0246815-mars21-mars27-mars2-avr8-avr14-avr20-avr26-avr2-mai8-mai14-mai20-mai26-mai1-juin7-juin13-juin19-juin25-juin1-juil7-juil13-juil19-juil25-juil31-juil6-août12-août18-août24-août30-août5-sept11-sept17-sept23-septcaptures moyennesLot-et-Garonne 2016Lot-et-Garonne 2015Moyenne 2002-2015 Le troisième vol, a débuté autour du 12 juillet.
615	1	a	N° 16 – 26 mai 2016 Champagne-Ardenne A RETENIR CETTE SEMAINE BETTERAVE (page 2) :  Croissance : stade moyen de 8 feuilles vraies  Ravageurs : timide évolution des pucerons ; premiers œufs de pégomyie  Maladies : quelques cas de bactériose faisant suite aux orages CÉRÉALES (page 4) :  Blé : stade majoritaire épiaison.
697	1	a	• Adventices Des levées d'adventices sont toujours observées.
668	1	a	Des chenilles ont été observées sur de nombreux sites : Oeregrave, Briscous, Arbonne, St Pée sur Nivelle, Itxassou, Bidaray, Louhossoa et Juxue.
855	2	a	• Clermont-Ferrand : le risque mildiou, demeure en zone très favorable durant toute la durée de la période de simulation.
280	0	a	Goyave (Psidium guajava L.) : fruit du goyavier, il existe des variétés de goyaves jaunes (goyave poire) ou vertes (goyave pomme). Source Agreste Statistique Agricole Annuelle: présentation générale
372	1	a	POMMIER Anthonome : poursuite des captures Tavelure : pas de risque sans pluie Oïdium : conditions favorables POIRIER Psylles : Début des éclosions et poursuite des pontes Cécidomyie : captures Tous fruitiers Pucerons- Chenilles : Risque important Hoplocampes : sortir les pièges N°4 du 27 mars 2012 Arboriculture Phénologie Pommier : D3 Poirier : D3 Pommier Anthonome Situation actuelle Les captures se poursuivent dans les parcelles à historique malgré les applications.
191	0	a	Bettes à cardes (Beta vulgaris L. var. flavescens L.) : cardes blanches, vertes ou rouges. Elles sont également appelées blettes ou poirées. Source Agreste Statistique Agricole Annuelle: présentation générale
536	1	a	Description A partir de plantes infectées, la transmission se fait par l’intermédiaire de nombreuses espèces de pucerons, le puceron noir Aphis gossypii est prépondérant.
250	0	a	Le corossol, appelé aussi corossol épineux, ou encore cachiment, comme d'autres fruits des arbres du genre Annona, est le fruit du corossolier (Annona muricata, de la famille des Annonaceae), qui pousse en Afrique, en Amérique et en Asie. Source Wikipédia
655	1	a	AUTRES RAVAGEURS Des observations sont relevées sur :     Buprestes sur conifères à écaille Pucerons avec de faibles pressions désormais sur Nerium, Rosier, Malus, pêcher Pucerons lanigères sur tronc de Malus Otiorhynques avec larves et nymphes Cochenilles sur bambous, Morus  Ces risques sont faibles à l’’échelle régionale, mais fort localement.
871	2	a	Lemontat : Le risque mildiou, demeure en zone très favorable durant toute la période de simulation.
254	0	a	Ce poste comprend notamment le fenouil (Foeniculum vulgare Mill.) destiné à la fabrication de boissons anisées (le fenouil bulbe est classé en légumes), la sauge sclarée (Salvia sclarea), la menthe verte (Mentha spicata L.) utilisée comme assaisonnement, la menthe poivrée (Mentha x piperita L.) pour la fabrication d’essence, etc. Les superficies en lavande et lavandin non destinées à la distillation mais à la fabrication de bouquets parfumés figurent ici. Pour les départements d’outre-mer, sont renseignés ici notamment : le cacao (Theobroma cacao L.), le café (coffea), le curcuma (Curcuma longa L.), le Gingembre (Zingiber officinale Roscoe), le poivre (Piper), le thym (Thymus). Les piments sont exclus, ils sont classés dans les cultures légumières. Source Agreste Statistique Agricole Annuelle: présentation générale
974	2	a	Plus on avance vers la fermeture de la grappe et plus ces dernières prennent de la résistance vis à vis des attaques de mildiou.
266	0	a	Les féveroles ou féverolles ou fèveroles (d'après la nouvelle orthographe) sont des plantes annuelles de l'espèce Vicia faba. Ce sont des légumineuses de la famille des Fabaceae, sous-famille des Faboideae, tribu des Fabeae. Il existe divers cultivars de féveroles sélectionnés pour la culture de plein champ et l'alimentation animale des ruminants, des porcs et des volailles, pour ce dernier usage, les cultivars à graines blanches moins riches en tanins sont préférés. Source Wikipédia
134	0	a	Ensemble de plantes cultivées à grande échelle dont les produits sont  destinés principalement à l'industrie pour la transformation, la conserverie. Les produits transformés peuvent être destinés à l'alimentation humaine ou animale ou être des produits non alimentaires. Type de production mécanisée.
965	2	a	Oïdium 12 L5 0 BSV viticole Rhône Alpes Page 10 sur 16 BULLETIN DE SANTE DU VEGETAL RHONE-ALPES Mildiou : Sorties de taches sur feuilles de mildiou plus ou moins importantes principalement sur la Combe de Savoie, mais aussi dans l'Ain sur le secteur Lhuis et Seillonnaz.
575	1	a	Les parcelles ayant atteint le stade 4 feuilles sont maintenant hors de risque vis-à-vis des petites altises.
101	0	a	Plante cultivée pour ses feuilles et ses tiges comestibles par l'homme sous forme de légume en salade: le cresson. Il existe une plante non cultivée dont les feuilles et les tiges sont  comestibles par l'homme sous forme de légume le cresson.
25	0	a	arbuste tropical cultivé pour son fruit atte ou pomme cannelle.
1068	2	a	 Oïdium L’oïdium est présent dans la culture en production depuis début septembre mais la pression reste faible.
960	2	a	Maladies cryptogamiques: Comme la semaine passée on note encore une progression du mildiou et de l'oïdium (notamment sur grappes pour l'oïdium).
458	1	a	Les plantes sont poussantes dans leur ensemble, adventices compris.
900	2	a	L’oïdium est signalé dans 1 parcelle avec symptômes sur siliques.
986	2	a	(cid:1) Pour apprécier la virulence et la répartition du mildiou dans le vignoble, nous vous remercions de bien vouloir nous signaler les premières taches détectées dans votre secteur.
652	1	a	CICADELLES & COCHENILLES Cicadelles : le risque reste élevé sur la gamme des aromatiques sur toute la région avec une faible pression sur le thym, le romarin, la verveine et forte pression sur la menthe.
992	2	a	ASCOCHYTOSE 1 parcelle de pois signale la présence d’ascochytose (anthracnose).
534	1	a	Auvergne Clermont-Ferrand : Avec les pluies successives survenues ou en prévision du 3 au 13 juillet, le risque mildiou, bien que demeurant en zone défavorable durant toute la durée de la période de simulation, remonte pour venir frôler la zone favorable en fin de simulation.
535	1	a	"Vous trouverez une fiche de signalement en cliquant sur le lien suivant : ""Fiche de signalement Ambroisie"" Estimation du risque L'ambroisie à été signalée sur le secteur de Sarlat avec 20 plantes / m2 sur 5% de la parcelle, ainsi que sur le secteur de Cahors sur 1 ha."
170	0	a	Fruits à coque. Source Agreste Statistique Agricole Annuelle: présentation générale
762	2	a	Zone géographique Avec Symptome Minimum Maximum 50 Minimum Maximum - Mildiou (Plasmopara viticola) Zone géographique MILDIOU -> NOMBRE CEPS ATTEINTS (AU MOINS 1 TACHE)/100 CEPS Nb Avec Nb observ.
103	0	a	culture des plantes à fleurs et des plantes vertes d'ornement.
9	0	a	liane cultivée pour son fruit le kiwi
1052	2	a	L’oïdium est favorisé par des écarts de températures « nuit-jour » importants.
1016	2	a	Analyse de risque : La remontée des températures prévue samedi et les averses orageuses des jours suivants pourraient être favorables au développement du mildiou.
611	1	a	Présence faible ; o Taupins  traces (moins de 1 % des plantes touchées) dans une parcelle à MONTFEY (10), non signalés dans les 16 autres parcelles observées.
291	0	a	Selon le dictionnaire de l'Académie française, l'horticulture est un art. C'est celui de cultiver les jardins, de pratiquer la culture des légumes, des fleurs, des arbres ou arbustes fruitiers et d'ornement. Source wikipédia
358	1	a	Risque faibleRisque élevéRisque faibleRisque élevéRisque faibleRisque élevéRisque faibleRisque élevéRisque faibleRisque élevéRisque faibleRisque élevéRisque faibleRisque élevéRisque faibleRisque élevé Bulletin n°14 du 26 mai 2009 Si on compte plus de 10 cécidomyies oranges dans la cuvette, il est conseillé de revenir sur la parcelle le soir même pour observer la présence de femelles en activité de ponte.
189	0	a	La betterave sucrière est un type de betterave cultivé pour sa racine charnue utilisée principalement pour la production du sucre (saccharose). Source Wikipédia
449	1	a	Sur le 49, en périphérie angevine, sur jeunes plantations, forte pression thrips, avant installation des auxiliaires PBI (2 thrips par feuille sur 80% des plantes).
1114	2	a	Pour les autres, rhynchosporiose et oïdium dans 20% des situations et rouille naine dans 15% des parcelles.
246	0	a	Le combava (ou combawa, cumbava, cumbaba, makrut, citron combera, lime kaffir) est un agrume dont le nom provient des anciennes cartes maritimes où une île indonésienne à l’est de Bali, dans l'archipel de la Sonde dans la mer des Moluques, est dénommée « Sumbawa ». Il est originaire de ces îles. C'est le nom de l'arbre (Citrus hystrix) et de son fruit. Il appartient à la famille des Rutacées. Source Wikipédia
1063	2	a	Hors parcelles réseau : Peu ou pas de symptômes sur feuillage observés sur le vignoble Les conditions météorologiques des jours précédents commencent à être plus favorables au champignon de l’oïdium Modèle Potentiel Système et niveau de risque : Des contaminations sont maintenant simulées par le modèle pour le début de semaine pour tout le vignoble d’Est en Ouest.
283	0	a	Le goyavier de Chine (P. cattleianum Sabine1), également appelé goyavier-fraise, est un arbuste fruitier de la famille des Myrtaceae originaire d'Amérique du Sud (contrairement à ce que son nom français pourrait faire croire). Source Wikipedia
121	0	a	Plante cultivée pour ses graines riches en protéines, comestible par l'homme sous forme de légume frais ou sec. Les graines sont utilisées en alimentation animale.
749	2	a	BSV viticole Rhône Alpes Page 6 sur 19 BULLETIN DE SANTE DU VEGETAL RHONE-ALPES Vignobles du Forez et du Roannais (6 parcelles observées sur 6)  Stades phénologiques Stade phénologique observé Chardonnay - - intermédiaire (33-35) Gamay - - intermédiaire (33-35) Gamay - fermeture de la grappe (33) Nombre de parcelle soit 33,3 % 33,3 % 33,3 %  Situation sanitaire (éléments remarquables) Oïdium (Erysiphe necator) OIDIUM -> NOMBRE GRAPPES ATTEINTES / 100 G Nb observ.
33	0	a	Plante tropicale cultivée pour son fruit comestible par l'homme comme légume sous le nom de banane plantain
796	2	a	Oïdium : Evolution significative de l’oïdium dans les parcelles sensibles.
243	0	a	Colza et navette (Brassica napus L. var. napus et Brassica rapa subsp. oleifera DC.) Le colza-fourrager est porté en « fourrages annuels ». Source Agreste Statistique Agrciole Annuelle: présentation générale.
550	1	a	On distingue alors les nématodes à galles : Meloïdogyne sp., de ceux à kystes : Globodera tabacum.
793	2	a	D'après les résultats de l'enquête 2014, les pertes dues au mildiou sont de l'ordre de 3%.
1026	2	a	MILDIOU Etat général Présent dans une culture de persil sous abri proche de la récolte.
199	0	a	Camelina sativa, de son nom vernaculaire cameline, également appelée « lin bâtard » ou « sésame d'Allemagne », est une plante de la famille des Brassicaceae, originaire d'Europe du Nord et d'Asie centrale, et cultivée en Europe depuis plus de 3 000 ans pour la production d'huile végétale et de nourriture pour animaux. Source Wikipédia
264	0	a	Épinards (Spinacia oleracea L.) : en frais, en branches. Production pour le marché de frais et l’industrie. Source Agreste Statistique Agricole Annuelle: présentation générale
223	0	a	Endives (Cichorium intybus L.) (ou chicorée de Bruxelles ou chicorée Witloof) Compte tenu du mode de culture de ce légume, la production de racines est distinguée de la production de chicons. La surface concerne les racines alors que la production concerne les chicons. La production d’endives s’effectue en deux étapes : d’abord la production de racines obtenue par semis puis éclaircissage, puis la production de chicons obtenue par forçage des racines. La formation du chicon a lieu, sur la même exploitation ou sur une autre exploitation. Elle se réalise à l’obscurité pour obtenir un produit blanc et non amer. Elle s’obtient selon deux méthodes : en couche (méthode traditionnelle), ou en bacs (en salle de forçage, les racines étant irriguées par une solution nutritive). Les racines d’endives ont été semées au printemps et ont été récoltées à l’automne de la même année. La production de chicons est étalée de l’automne jusqu’en août de l’année suivante. Source Agreste Statistique Agricole Annuelle: présentation générale
553	1	a	 Le seuil de nuisibilité des pucerons n'est pas atteint.
371	1	a	% de parcelles au stade 100% 90% 80% 70% 60% 50% 40% 30% 20% 10% 0% Stade réseau SBT Lin oléagineux de printemps A2 (= levée, cotylédons visibles) B1 (= 2 premières feuilles ouvertes) B2 (= 3 cm) B5 (= 5 cm) B9 (= 7 cm) C1 (première ramification) Nombre de parcelles - 1 - 1 Localisation (département) 79 17 - 35 - 35 - 18 - 36 C1 B9 B5 B2 B1 A2 Rappel des stades : Voir annexe en fin de bulletin (Source : CETIOM) Risque altises + - ’ Aucune altise n’a été observée sur les parcelles ayant fait l’objet cette semaine d‘un suivi de ce ravageur.
660	1	a	PUNAISES LYGUS Les Lygus rugulipennis : présence encore de quelques adultes et/ou larves, mais en général le risque est passé.
88	0	a	agrume cultivé pour son fruit le citron.
529	1	a	Elle est difficile à observer au stade L1 à L3 car petite et se niche au creux des feuilles à l’insertion avec la tige !
522	1	a	Elle forme une chrysalide avant de se transformer en adulte, dont le seul but est de se reproduire, etc. Chenille extraordinairement polyphage, elle possède un potentiel de reproduction élevé.
20	0	a	arbre cultivé pour son fruit à coques.
702	1	a	Cicadelles de la flavescence dorée : Toujours des niveaux de population plus bas que les années précédentes.
318	1	a	La présence d’abeilles ou de guêpe en bol jaune se réduit.
746	2	a	De nouveaux foyers devraient apparaître ces prochains jours BSV viticole Rhône Alpes Page 4 sur 19 BULLETIN DE SANTE DU VEGETAL RHONE-ALPES Vignobles des Côtes du Rhône septentrionales ( 30 parcelles observées sur 33)  Stades phénologiques Stade phénologique observé Marsanne - fermeture de la grappe (33) Marsanne - - intermédiaire (33-35) Marsanne - - intermédiaire (31-33) Roussanne - - intermédiaire (33-35) Syrah - - intermédiaire (31-33) Syrah - - intermédiaire (33-35) Syrah - fermeture de la grappe (33) Syrah - début véraison baies translucides se colorent (35) Viognier - fermeture de la grappe (33) Viognier - - intermédiaire (33-35) Viognier - début véraison baies translucides se colorent (35) Nombre de parcelle 13 soit 6,7 % 3,3 % 3,3 % 3,3 % 3,3 % 43,3 % 13,3 % 3,3 % 3,3 % 13,3 % 3,3 %  Situation sanitaire (éléments remarquables) Oïdium (Erysiphe necator) OIDIUM -> NOMBRE GRAPPES ATTEINTES / 100 G Nb parcelles Nb observ.
448	1	a	Thrips Thrips Des piégeages très élevés sur les sites de suivi et en forte augmentation sur deux d’entre eux.
160	0	a	Actinidia ou Kiwi (Actinidia deliciosa [A. Chev.] C.F. Liang et A.R. Ferguson) : fruit également appelé yang tao, groseille de Chine. Source Agreste Statistique Agricole Annuelle: présentation générale
39	0	a	Ensemble de plantes cultivées pour ses grains comestibles par l'homme sous forme de céréales ou de farine. Les grains sont aussi utilisées en alimentation animale. La tige de la plante est aussi utilisée en alimentation animale comme paille.
930	2	a	Le passage sur tige n’a pas été systématique mais relativement fréquent le phomopsis sur tige est puisque observé sur un peu plus de 50% des parcelles contre seulement 38% en 2010.
61	0	a	Ensemble de plantes cultivées pour leurs feuilles et leur racine comestibles par l'homme sous forme de légumes ou d'aromates: le cerfeuil. Certains de ces plantes peuvent être vendues en frais ou utilisés pour l'industrie alimentaire.
1006	2	a	La pression de la septoriose est forte dans les parcelles témoin.
659	1	a	Elles peuvent même s’attaquer aux larves d’otiorhynques.
841	2	a	Maladies On observe peu de mildiou actuellement dans les parcelles, malgré un temps très favorable.
958	2	a	Oïdium : En Coteaux du Lyonnais sud, l’oïdium poursuit sa progression sur les parcelles suivies, essentiellement sur chardonnay : 18 à 27% de feuilles avec symptômes et 12 à 36% de grappes atteintes sur les parcelles suivies à Millery et Taluyers.
1007	2	a	SEPTORIOSE La pression de la septoriose persiste dans les parcelles témoins du réseau.
828	2	a	• Oïdium : le stade phénologique de réceptivité n'est pas encore atteint.
680	1	a	 - - Pic 1er vol 2010 Pic 2d vol 2011 Pic 2d vol 2010 Pic 2d vol 2012 Bulletin de santé du végétal Aquitaine - Légumes de plein champ N°20 – 8 novembre gggggggggg ggggg ' - Infestation de sésamies dans les parcelles de maïs grain avant récolte ,2 1 0,8 0,6 0,4 0,2 0 Gironde Landes Py rénées A tlantiques Lot et Garonne Moyenne A quitaine Piége age d'hé l iothis en Aquita ine le de rniè re s anné cumul de s capture s journa l iè re s moyenne s pa r piège • Heliothis En 2012, le vol d’héliothis a été assez important si on le compare aux 7 dernières années : voir courbe en rouge des captures journalières cumulées dans le graphique ci-dessous.
607	1	a	Placez dès à présent les pièges sexuels pour suivre le début du vol.
904	2	a	Les fortes pluies de ces derniers jours ont contribué à l’effet « splashing » permettant à la septoriose de continuer sa progression vers les dernières feuilles.
138	0	a	Plante potagère cultivée pour ses graines comestibles par l'homme sous forme de légume vert ou sec: le flageolet ou haricot à écosser ou haricot demi sec.
172	0	a	Fruits à pépins. Source Agreste Statistique Agricole Annuelle: présentation générale
775	2	a	 Retrouvez le bulletin de santé du végétal sur le web...  www.draaf.pays-de-la-loire.agriculture.gouv.fr  www.paysdelaloire.chambagri.fr  www.fredonpdl.fr … ou inscrivez-vous en ligne pour être infor- mé directement par mail de chaque nou- velle parution : www.paysdelaloire.chambagri.fr/menus-horizontaux- agrilianet/vegetal/surveillance-biologique-du- territoire/sinscrire-au-bsv-cest-gratuit.html Page – N °  Tavelure Observations L’examen des périthèces de la tavelure du pommier permet de suivre l’évolution de leur maturation.
784	2	a	Mais le temps brumeux accroit les risques Pas de mildiou sur culture non bâchée, quelques taches isolées sur parcelle débâchée tardivement.
213	0	a	les céréales récoltées en vert (essentiellement maïs, mais aussi sorgho, blé,seigle, etc.) sont classées en fourrages annuels. Source Agreste Statistique Agricole Annuelle présentation générale
829	2	a	Niveau de risque Aucun risque de contamination épidémique Oïdium • Eléments de biologie Fiche pratique en ligne : INRA En Aquitaine, l'oïdium se conserve durant l'hiver grâce à des cléistothèces, structures issues de sa reproduction sexuée se formant à la surface des organes herbacés en fin de saison.
673	1	a	Noctuelles terricoles  Localement observé.
161	0	a	Source registre parcellaire data.gouv.fr
957	2	a	BSV viticole Rhône Alpes Page 2 sur 16 >10 3 >5 2 BULLETIN DE SANTE DU VEGETAL RHONE-ALPES Oïdium (Erysiphe necator) OIDIUM -> NOMBRE FEUILLES ATTEINTES / 100 F Nb parcelles Nb observ.
7	0	a	arbre fruitier à noyau cultivé pour son fruit l'abricot.
1036	2	a	Les résultats de modélisation de Miloni (modèle mildiou oignon) sont présentés sous forme de tableau (voir ci-dessus).
297	0	a	Salades laitues (Lactuca sativa L.) Source Agreste Statistique Agricole Annuelle: présentation générale
179	0	a	Avocats (Persea americana Miller) Source Agreste Statistique Agricole Annuelle: présentation générale
248	0	a	Type de concombre à petits fruits verts récoltés à l'état jeune et mis en conserve dans le vinaigre ou la saumure et consommé comme condiment (espèce Cucumis sativus, famille des cucurbitacées). Source Larousse Agricole
4	0	a	plante utilisée en prairie pâturée ou en fauche.
911	2	a	Bactériose (Pseudomonas syringae pv.
952	2	a	• Oïdium Des premiers symptômes sont signalés sur le réseau de surveillance.
1113	2	a	Oïdium Présence et nuisibilité faibles.
605	1	a	Mesures prophylactiques : Parcourir les parcelles pour bien observer les arbres et déceler les symptômes.
105	0	a	Ensemble de plantes, d'arbres ou d'arbustes cultivés pour leurs fruits comestibles par l'homme sous forme de fruits. Les fruits peuvent subir une transformation et être mangés sous forme de jus de fruits alcoolisés ou non.
225	0	a	Salades chicorées frisées (Cichorium endivia L. var. latifolium Lam.) la chicorée frisée : les feuilles sont très découpées et la pomme peu ou moyennement dense. Les principales variétés sont : Très fine maraîchère, Été à cœur jaune, Grosse pommant seule, Wallonne, ... ; Source Agreste Statistique Agricole Annuelle: présentation générale
